id;review_title_e_message;Satisfeito
21493;podia melhorar, por que eu tive que buscar nos correios e eu queria receber em casa;1
21495;moito imatura essa loja, não cumpre com seus clientes o que promete, atraso e ainda cobra um frete muito caro, para não ser entregue, estou aguardando o produto chegar.;0
21515;satisfeita  produto entregue dentro do prazo, aliás bem antes da data final prevista.;1
21560;solicitei o cancelamento do item pelo site. por que estou a ser questionada sobre recebimento? não recebi e nem vou! favor atualizarem informações!;0
21570;"recomendo recomendo a loja.
produto entregue antes do prazo.";1
21584;vale a pena comprar na lannister..;1
21588;ótimo produto, chegou na embalagem bem lacrada e antes do tempo previsto de entrega.;1
21594;entregue antes do prazo;1
21596;"até o momento não foi entregue o produto completo. fico no aguardo
carla goés";0
21616;"produto fácil de usar, eficiente.
os vidros ficam limpinhos.";1
21653;produto não chegou;0
21658;tudo ok;1
21663;dizia de 3 a 5 dias uteis após aprovação pgto contei 5 dias uteis comprei dia 4 sábado tinha esperança entrega antes contei de segunda a sexta recebi dia 13.;1
21679;recebi apenas 2 pendentes falta o restante com uma vendedora eu consegui falar e ela ja enviou os outros 4 pendentes, ja os amarelos ainda não recebi nenhum estou aguardando faltam os 5 amarelos...;0
21681;recomendo entrega super rápida;1
21714;ótima loja eu recomendo;1
21721;recomendaria o produto chegou bem antes a data programada. achei ótimo!;1
21738;muito bom quanto a entrega , ótimo produto;1
21750;muito bom!;1
21751;gostei do kit e recomendo essa loja;1
21753;paguei caro pelo frete e n foram entregues na minha casa.tive q pegar no correios e só veio uma e mesmo assim o modelo errado. já enviei 2 e-mail espero o contato pq quero a devolução do meu dinheiro.;0
21755;recomendo procedimento de compra até a entrega nota 10.;1
21791;bom produto;1
21799;até o momento eu não recebi minha entrega.;0
21828;amei gostei muito do produto;1
21835;muito bom;1
21858;"mto bom .. 
atendido bem antes do prazo super recomendo";1
21865;"o relógio que comprei nesta loja, a luz do meio com menos de 20 dias de uso não acende mais. gostaria que trocasse ou se for o caso haja devolução. por gentileza me dar algum retorno.

obrigada";0
21873;falta um produto;0
21880;cheiro horrível  o produto é bom, mas tem um cheiro insuportável de cola de sapateiro;1
21888;tudo ok chegou tudo conforme combinado.;1
21898;"o produto é totalmente de má qualidade, as ""bolinhas"" são na verdade adesivos de papel, e as latas vem completamente preta por dentro, podiam ser limpas pelo menos.";0
21903;gostei de tudo;1
21913;atendeu as minhas expectativas.;1
21933;nota 0 comprei dia 07/08 na targaryen com prazo de entrega até 21/08 e até agora não recebi o produto.;0
21945;toppp;1
21946;entrega muito rápida! produto excelente e entrega muito antes do previsto!;1
21966;super recomendo;1
21978;o pendrive e 2.0 nao funcionando no meu computador : /;0
21995;bom  o prato é de boa qualidade mas é bem pequeno. recomendo apenas para bebês.;1
22017;produto muito bom, recomendo.;1
22047;otima loja.;1
22055;lindas!!!  amei! a luminária é linda e enorme... apaixonada;1
22058;é uma merda  bem comprei um produto que custava 261.00 reais o melhor que eles tinham com o cartao de 32g . e me mandarão o pior que eles tinha era de 140.00 reais que vinha com cartão de 16g resumindo safados.!!!;0
22061;10;1
22073;chegou antes do prazo;1
22097;comprei três produtos que poderiam ser enviados dentro de um pacote só e assim talvez poderia economizar no frete.. achei um absurdo pagar no frete quase metade do valor em si..;0
22101;entrega super rápida ainda não apliquei o produto mas parece ser de ótima qualidade.;1
22102;5 estrelas muito bom recebi tudo certinho do jeito que pedi;1
22113;a melhor loja para comprar,chega até antes do prazo.os produtos são de qualidade e a loja e acelente, espero sempre está comprando,e recebendo sempre com qualidade todos os produtos.agora vô espera a;1
22124;parceiro muito bom, vale a pena comprar com essa loja.;1
22134;super recomendo adorei;1
22153;ainda não recebi o produto e nem responderam a minha pergunta;0
22164;perfeito;1
22167;recomendo sempre que faco compras recebo direitinho os produtos;1
22173;o lg d300 lindo pena que não tem android o mais ele é completonho.;1
22194;este produto era o que eu esperava;1
22204;mto bom. chegou antes do prazo.;1
22205;me mandaram um produto com a medida muito menor do anunciado. solicitei a troca.;0
22218;bom  gostei.;1
22248;entrega dentro do prazo.;1
22258;10;1
22265;5 estrela bom ótimo atendimento;1
22266;recomendo produto entregue dentro do prazo estipulado.;1
22268;ainda não recebi o produto.;0
22271;recomendo;1
22334;super recomendo! produto veio dentro do prazo, muito bem embalado e de acordo com o enunciado no site. podem comprar sem problemas!;1
22345;problemas entregaram apenas um produto dos quatro itens do pedido... quero o restante do pedido... cadê?;0
22347;fiquei surpresa quando chegou somente um produto do que eu havia pedido. depois percebi que seriam entregues por duas transportadoras. ate o momento ainda não recebi a outra mercadoria. preocupada.;0
22351;bom linda boneca .como é presente não tirei da caixa para ver como esta .mas aparentemente tudo certo;1
22355;"se vc não tem o produto pra me entregar
por que vcs não devolvem o meu dinheiro..
...vcs querem que eu entre na justiça
aguardo uma posição da lannister";0
22395;não tenho notícia do produto comprado;0
22396;não recomendo porque comprei um forno e dois dias depois fiz devolução porque queria uma outra marca. até agora não tive ressarcimento do valor pago;0
22398;pontualidade e confiança;1
22401;tudo ok entregaram no prazo tudo ok;1
22416;frete caro frete muito caro!!!!;1
22417;cartucho com problema não recomendo. produto não funcionou e veio numa embalagem sem proteção.;0
22420;houve falha nas informações sobre a venda.;0
22422;chegou antes do prazo,igual o da foto adorei.;1
22440;original novo perfeito;1
22450;o produto chegou corretamente, e antes do prazo previsto!;1
22451;bom bom;1
22462;comprei dois moto g5 s plus com duas capas e duas películas. as lannister não aprovou o pagamento dos smartphones, mas enviou as capas com as películas. é difícil viu.;0
22464;a cafeteira é muito bonita, de vidro, é resistente e fácil de limpar. a tampa é de plástico duro, coberta por uma pintura metálica, seria melhor se fosse de metal, mas, pelo menos, a qualidade é boa.;1
22465;chegou no prazo! em ótimas condições;1
22471;xxxxx;1
22481;prazo não foi cumprido ... até hoje não chegou :( primeira vez que tenho problema com entrega.;0
22490;pelo motivo da demora ate hoje ainda não recebi minha mercadoria, estou no aguardo.;0
22511;a entrega foi muito rápida e o produto atende as expectativas!;1
22514;entrega rápida;1
22521;super satisfeita;1
22536;veio tudo sertinho bem imbalado tudo ok;1
22553;o produto é bom, quebra bem o galho, mas o frete saiu caro;1
22577;produto chegou rápido;1
22579;entrega muito rápida parabéns;1
22615;produto excelente o produto é ótimo, minha única reclamação e sabre a entrega, que não foi feita na minha residência;1
22622;produto entregue no prazo.;1
22631;produto chegou bem antes do prazo estipulado pela loja. estão de parabens, super recomendo.;1
22633;"produto não recebido olá!
ainda não recebi o produto e o prazo informa para entrega seria para dia 04.06.2018, mais até o momento nada......";0
22652;muito bom;1
22672;super recomendado super satisfeita com o produto e entrega;1
22716;bom;1
22730;chegou antes prazo, tudo certo e sem defeitos;1
22740;parabéns pela seriedade da targaryen.;1
22743;bom;1
22749;enviaram o produto errado.;0
22763;10 exelente;1
22764;produto de qualidade e entrega rápida.;1
22772;entregou no prazo não recebi o produto que comprei, veio um produto parecido;0
22783;amo esse baratheon....;1
22784;muito boa;1
22789;nota 100000000;1
22791;??????;1
22792;ótimo pago na terça e entregue na quinta.;1
22794;entrega rapida;1
22795;pela indicação achei que peça seria maior.;0
22796;excelente  parabéns pela rapidez;1
22822;comprei dois produtos e só chegou um. muito decepcionado;0
22841;bom o produto foi entregue conforme o combinado.;1
22858;chegou no prazo e aparentemente em ordem;1
22859;entregue antes do prazo, super rápido.;1
22877;bom produto produto em perfeito estado;1
22886;ótimo brinquedo para crianças maiores de três anos, meu filho amou;1
22902;produto de acordo com a foto e descrição, era exatamente o que eu queria. grato!;1
22918;cumpriu com o esperado;1
22937;parece que foi vendido um produto indisponivel na loja;0
22939;freter$110.00 retirar cor estou um pouco decepcionada porque paguei um frete caro!agora recebo a notícia que terei que ir buscar no correio que fica do outro lado da cidade que moro!paguei o frete para receber em casa!!mas....;0
22967;produto muito bom, exatamente o demonstrado no site.;1
22981;só achei desleixada a maneira que o produto foi embalado;1
22986;bom os produtos vieram conforme o pedido;1
22999;produto excelente e chegou antes do prazo.;1
23000;escolhi as taças com caveira mexicana, foram entregues as de pôquer.;1
23034;o produto veio com defeito enviei email e nao obtive resposta;0
23061;tudo de bom!!!;1
23074;"excelente loja, ocorreu tudo certo e recebi o produto até antes do prazo.
100% recomendo.";1
23078;muito bom;1
23089;excelente foi entregue antes do prazo e o produto é de ótima qualidade;1
23090;"falta de respeito como cliente estou insatisfeita com o pó-venda, não consigo atendimento em nenhum doos canais de atendimento, alias só há um canal, fone, só que por meio de atendimento eletronico;;;";0
23091;fiquei satisfeita com o meu produto.;1
23102;entregou antes do prazo muito bom satisfeito;1
23108;produto bom, imaginava outro tecido, mas veio exatamente o descrito.;1
23110;bom pensava que os anzóis eram maiores mas ta bom !!;1
23138;a capa serve tanto pra hd externo de 1tb como para câmera fotográfica, encaixou legal.;1
23149;nota 10 tudo otimo,produto,entrega e suprte maravilhoso da lannister.com;1
23176;faltou 2 produtos na entrega, tive de ligar na loja para reclamar.;1
23177;muito bom;1
23188;o produto chegou na metade do prazo, em bom estado.;1
23189;ótimo  sempre vou comprar aqui pois é a melhor parabéns;1
23193;tudo veio perfeito,produto certo tempo antes do previsto.;1
23236;muito ruim o produto é de péssima qualidade veio faltando parafuso e ainda não encaixa no vaso,não recomendo, vai jogar dinheiro fora.;0
23247;excelente???? o produto veio antes do prazo e eu ameii, do jeito que imaginei!;1
23257;chegou em menos de 7 dias, minha esposa adorou, perfeito!;1
23266;nao recebi o produto e o lojista nao se preocupa em dar a minima satisfaçao ao cliente.;0
23279;nada a declarar.;1
23284;muito bom;1
23285;péssima loja;0
23288;a mercadoria não veio com condições de uso o fio dela feito dorto e uma qualidade muito ruim.;0
23295;comprei dois pneus ( dianteiro e traseiro ) mas so recebi o traseiro.;0
23301;eu não recebi o produto ainda;0
23307;muito útil! maravilhoso acabei de adquirir mais espaço em meu armário!;1
23308;veio no prazo, o cubo já veio lubrificado e ajustado;0
23312;gostei do compromisso da loja, produto bem como imaginava, tudo serto, recomendo.;1
23318;produto muito diferente do que mostra ..material muito fraquinho pano muito fino .. não gostei;0
23337;"veio mais linda que na foto e chegou 10 dias antes do prazo
amei, super indico ??????";1
23355;superou as minhas expectativas. ótima qualidade, moderna e elegante. além de carregar o notebook, posso colocar livros e cadernos. há tempos procurava por uma pasta, valeu a pena! super recomendo.;1
23357;produto com pequenos pontos de ferrugem. não estava em perfeito estado.;1
23360;"a entrega ocorreu antes do prazo estipulado!!
muito bom.
produto conforme mostrado no site.
estou satisfeito com o produto.";1
23361;excelente fornecedor recebi o produto antes do prazo e com um defeito ocasionado pelo transporte. contudo, o fornecedor foi super atencioso enviando um novo produto que chegou super rápido.;1
23376;produto de qualidade e bonito, meu filho adorou.;1
23377;o produto é muito lindo, chegou rapidinho!;1
23379;o produto veio com dimensões erradas e avariado.;0
23416;o produto principal ainda não foi entregue e consta no site como entregue. ainda está dentro do prazo por isso estou aguardando o recebimento do produto.;0
23420;recebi antes do prazo. tudo chegou corretamente. excelente lojista. produto de qualidade.;1
23425;super recomendo,produto entregue bem antes do prazo e em perfeito estado;1
23426;pedi cor azul marinho e veio cor preta. tudo bem, é quase igual, né? deixa pra lá, porque para trocar esta bolsa vai me dar muito trabalho, mas para uma compra de grande valor não vale a pena.;0
23430;entrega super rápido, eu recomendo!! !;1
23435;perfeito! produto de ótima qualidade, bem embalado e entregue antes do prazo;1
23461;muito bom. o esperado.;1
23477;muito bom o produto chegou beem antes do prazo estabelecido. tudo certinho do jeito que eu queria.;1
23482;10;1
23486;a descrição do produto é tal qual o site indica.;1
23497;ótima;1
23507;super recomendo produto conforme anunciado, entrega super rapida;1
23513;10;1
23565;"compra efetuada com sucesso. 
tudo perfeito.
cliente super satisfeito";1
23582;recebi o produto usado.;0
23589;entregue bem antes do acordado, em perfeito estado.;1
23592;"recebi o forno avariado, com o puxador da porta quebrado, provavelmente no transporte.

tentei inumeras vezes solicitar a troca, que ainda não ocorreu.

estou aguardando a substituição";0
23602;ok!;1
23611;produto chegou antes do prazo.;1
23615;qualidade muita boa!;1
23618;"eles anunciam um produto, entregam outro.

não compro mais nesse loja e o pior é que esta difícil comprar no stark, tamanha a quantidade de lojistas ruins como esse.";0
23622;ótimo o pedido foi entregue muito antes do prazo estabelecido. super recomendo;1
23624;ainda não recebi este ite não recebi a lâmpada de led;0
23630;não gostei muito ruim não compro mais nessa loja.;0
23635;tentei fazer o cancelamento da compra e o site não permitiu. depois consegui, mas o débito no cartão de crédito foi efetivado;0
23646;muito bom, rápido como sempre;1
23650;chegou antes do prazo previsto;1
23652;"não recebi o produto que comprei.
recebi produto diferente";0
23671;produto entregue tudo certo, exceto algumas informações nas características do produto não procede;0
23679;as estampas são lindas e veio td no tempo certo e em perfeito estado. adorei.;1
23682;além de chegar no último dia, venho quebrado.;0
23695;"entrega rápida,falha prod o produto chegou rápido, no entanto o braço do encosto da cadeira estava instalado ao contrário. eu tive que desmontar e recolocar para ajustar o produto de forma correta.
não havia manual para tal.";1
23696;bom ele poderia ficar mais certo fica meio torto.;1
23702;satisfatória;1
23715;meu produto não chegou ,prazo de entrega de 34 dias e mesmo assim nao foi entregue ,não recomendo;0
23736;recomendo! produto de ótima qualidade e entrega muito antes do prazo;1
23744;ok;1
23760;não chegou nada do meu produto.;0
23762;produto muito bom e entrega rapida, obrigada;1
23763;"diferente da foto bom dia, o produto tem embalagem diferente da foto, mas confirmei com minha amiga e ela disse que era ele mesmo. então poderiam atualizar a foto.
quanto ao produto é excelente";0
23769;ainda estou esperando o produto chegar e o prazo era até ontem;0
23771;produto chegou certinho e rapido.;1
23775;recomendo sempre meus parabéns.;1
23799;recebi o produto muito antes do programado;1
23818;transação ótima. como tadas que fiz junto ao stark.;1
23821;"comprei e paguei um produto em 03/03/2018.
no dia 19/03 recebi mensagem da lannister.com dizendo que houve problema na entrega nos correios. desde então tenho reclamado sem obter nenhuma resposta.";0
23823;ótimo relogio, a pulseira é super confortável.;1
23832;bom o produto chegou em perfeito estado e antes do prazo estabelecido. o produtoné bom e atingiu as minhas expectativas;1
23856;produto enviado rapidamente. chegou direitinho. recomendo!;1
23901;recomendo a todos;1
23910;indico;1
23912;super recomendo produto muito útil e ótima qualidade;1
23923;maravilhosa, a cadeira veio praticamente montada, muito boa!;1
23950;o produto demorou muito para chegar e veio com defeito. ao contatar a loja, tive que insistir para trocarem mesmo com fotos dos defeitos e ainda por cima tive de pagar para enviar. prejuízo!;0
23953;capa protetora de celular igual a descrição, porém, o tamanho da capa e da pelicula de vidro veio maior doque o modelo descrito. super chateada por não receber o que era esperado.;0
23991;a loja foi rapida em preparar o produto para ser postado. porem os correios nao entregaram o produto, e ja faz mais de um mes.;0
23992;nao entregue sem informações sobre o paradeiro;0
24028;entrega no prazo, bem embalada, produto correto, estou muito satisfeito.;1
24041;ip;1
24053;8;1
24060;produto entregue no prazo, conforme combinado.;1
24071;produto lindo.;1
24086;somente o quadro cofre para minha próxima viagem 33x24x5cm foi entregue.;0
24091;entregou no prazo porém muito demorado.;0
24096;ok;1
24097;foi entregue antes do prazo,gostei!!!!;1
24103;muito bom, super recomendo ??;1
24105;produto entregue em mãos,lindo e original.desagradou o fato de cobrar taxa de entrega rápida 10 dias e não cumprir com o combinado.quero reembolso da taxa extra.não se vende o que não têm.;0
24122;pedi 3 unidades do produto é só foram entregues 2 unidades;0
24127;comprei um quite de tesouras fio navalha, mas não recebi o modelo que foi escolhido pelo site;0
24157;quero trocar e nao estou conseguindo a cinco dias;0
24162;bom;1
24163;recomendo compra excelente, ótimo serviço, ótimo produto.;1
24166;recomendo;1
24179;nota 10 produto entregue no prazo. e o atendimento sempre excelente.;1
24184;na minha avaliação considero o produto como não entregue pois está fora das especificações da minha compra no site o correto seria com a capacidade de 3 litros ao invés disto recebi um produto de 0,7l;0
24188;infelizmente o produto veio com defeito de fábrica e já acionei a devolução do produto;0
24189;não recebi o produto;0
24214;muita demora para a entrega.;0
24234;comprei dois kits para meus aparelhos j5 samsung. ambas capas plásticas tem corte errado, tapando o flash. a película não cobre toda a extensão da tela. desejo proceder com a devolução, para troca.;0
24239;pedido chegou mto rápido chegou em uma semana,o prazo era de um mês ou mais,pq em dia de jogo da copa não seria contado como dias uteis, fiquei muito satisfeita com a rapidez.muito bom .;1
24247;recebi corretamente, mto antes do prazo estipulado.;1
24249;"comprei dois produtos. 
este foi entregue no prazo.
o outro ainda não foi entregue e o prazo já acabou.";0
24254;muito bom;1
24261;10;1
24266;ótimo  muito bom esquenta rápido;1
24274;excelente relógio;1
24279;recebi produto diferente recebi um produto diferente do que pedi e não estou sendo assistida quanto a isso !;0
24280;gostei, recebi a tes do prazo;1
24281;o produto não é tão portátil quanto anunciado.;0
24298;tudo conforme anunciado! recomendo!;1
24300;muito bom..;1
24306;não recebi o kit transmissão ainda...;0
24315;boa boa;1
24322;gostei muito adorei, como na foto;1
24341;recomendo produto entregue rápido e conforme especificado;1
24344;ótimo;1
24353;gostei muito.;1
24361;"recebi o produto no prazo e em perfeitas condições. meu sobrinho gostou muito!
recomendo.";1
24362;loja lixo, entregaram produto errado, mandei email pro stark reclamando, nem obtive resposta, bela consideraçao por um cliente de tantos anos, qro ver o valor na minha fatura, ja q sao diferentes!;0
24367;ótima;1
24373;ótimo serviço;1
24380;"não foi entregue em casa .disseram que não tinha ninguém pra receber;só que tinha. usaram o expediente mais comodo ..entregar todas as encomendas no posto do correio e o cliente se vira pra retirar...";0
24381;produto muito bom! chegou certinho!;1
24390;produto bom. entrega rápida.;1
24397;tudo ok chegou tudo certinho e antes do prazo!!;1
24402;logo no primeiro dia já percebi um aumento da energia e disposição para fazer exercícios.;1
24405;duvidas:gostaria de saber se esse produto e mesmo original?a principio veio direitinho.;0
24416;excelente leitor, superou minhas expectativas.;1
24454;adorei meu relógio,muito lindo!;1
24465;ainda não instalei o pneu mas visualmente o produto parece bom e de procedência.;1
24477;cancelamento da compra  desde o dia 15 de agosto eu solicitei o cancelamento da compra em questão e até a presente data não obtive retorno.;0
24479;ótima compra.;1
24490;gostaria de saber como proceder para receber o produto, pois ainda o quero.;0
24496;"produto entregue no prazo, mas apresentando uma emenda visivelmente perceptível! 
uma pena! já tinha comprado um menor que veio perfeito.";1
24509;excelente loja e produto. recomendo;1
24529;bom;1
24535;apesar da demora na entrega pois o produto faltava em estoque mas estava a venda , o problema foi solucionado e o produto satisfez a expectativa;0
24556;falta de comprometimento como está especificado no pedido, solicitei o cadeira branca com lilás e recebo uma nota fiscal com a cadeira branca com roxa, é o produto branco com roxo, então a minha escolha não valeu de nada....;0
24569;"encomendado na loja, muito bem tratado.
entregue em casa em perfeitas condições.
??";1
24580;muito bom chegou rápido e como eu pedi.;1
24607;me chateou pois a lancheira que comprei não tinha... pediram pra escolher outro modelo ,escolhi só que a que mandaram já foi outro modelo..... minha filha gostou mais não fiquei totalmente satisfeita.;0
24614;é um cavelete bem prático, mas o acabamento deixa a desejar.;1
24616;chegou a mercadoria antes do prazo;1
24620;não recebi o produto ainda, mas aguardo receber até sexta feira. a previsão de entrega era dia 20.;0
24623;ate o momento nao recebi meu produto;0
24625;boa entrega não gostei do produto, pq ele é muito grande, mas é de ótima qualidade, só não é o q eu procurava...;1
24631;entregou o pedido antes do prazo.;1
24639;bom produto é serviço da loja;1
24643;entao segundo produto que atrasa pra chegar esse ia chegar 5/04 ainda nada de chegar;0
24646;deu tudo certo amei a mercadoria, e chegou até antes do prazo estimado... muito agradecida...;1
24660;demorou n veio a cor q escolhi e comprei um sofá caro e já faz mas se 1 mês e nada de entregar muito insatisfeita e fiz o cartão pelo site no nome de meu marido cyro dias braga entao fiz polishop;0
24665;"super recomendado só não veio na embalagem a mg de cada capsula.
se puder me informar fico grata.
elizane azzi";1
24666;"só chegou 1 dos dois produtos comprados

no caso chegou o bcaa e falta o hemo rage black";0
24674;wagner  100%;1
24679;acabei de receber o lençol, sempre recebo antes do prazo, dessa vez atrasou mais chegou, obrigada.;1
24689;muito bom. recomendo;1
24705;bom;1
24726;o produto demorou muito para chegar.... além disso as imagens na internet não deixam claro como é o produto real.....fora o frete que é muito caro.;0
24728;o tempo de entrega das lannister chega a ser 40 dias depois do pedido;0
24732;produto não entregue no prazo, ainda aguardando sem conseguir rastrear localização exata do produto, muito ruim o retorno ao cliente;0
24771;super recomendo!;1
24788;postagem fornecedor bem r[apido, entrega pelo correio demorou, não foi culpa do fornecedor..;0
24789;produto com defeito;0
24796;muito bom entrega rápida, produto bonito conforme descrito no site, porém so chegou o lençol ainda não chegou a saia da cama.;1
24809;elogios  ótimo;1
24823;gostei muito, satisfeito!!;1
24827;não foi entregue no tento estipulado e o codigo de rastreio está totalmente desatualizado.;0
24839;xxx;1
24842;produto de boa qualidade;1
24847;esta faltando o outro cor dourado, quando chegara?;0
24858;recebemos o produto antes do prazer estimado para entrega, dentro das especificações.;1
24866;tudo conforme o combinado.;1
24867;a capa veio de cor diferente da que eu pedi, e a película não é de vidro, e ainda por cima está torta;0
24875;apesar do produto não ter sido entregue na data correta e termos tido empecilhos com erro de endereço o parceiro foi extremamente ágil, gentil e profissional. recomendo o mesmo.;1
24899;otimo;1
24902;adorei o produto excelente qualidade.a entrega foi bem antes do prazo amei.obrigado a todos da equipe do choptaime deus abençoe a todos beijos.;1
24903;produto chegou antes do prazo final,veio bem embalado sem problema com a entrega ou com os produtos.compraria novamente;1
24916;recomendo vendedor correto, recebi o produto antes da data marcada, nada a reclamar.;1
24920;já comprei muitas vezes do baratheon e nas compras anteriores nunca houve problemas.;1
24925;ótimo ótimo;1
24927;produto entregue antes do prazo. recomendo com certeza;1
24955;diferente do esperado tem um bom aumento, mas ainda não é o que procuro pois, vc tem que ficar muito próximo, tem que quase encostar no objeto que observa.;0
24962;recomendo entrega antes do prazo previsto.;1
24987;"nas lannister gosto de comprar mas na targaryen
nao da pq cancelei o pedido no mesmo dia e ate hoje nao tem nada resolvido pois foi no cartao e ja paguei a primeira";0
24988;entregou dentro do prazo mas poderia ter entregue muito antes com tranquilidade e ainda entregou tudo errado comprei um cavalinho e mandaram um urso horrível!;1
25004;não recebi o kit bercinho;0
25012;muito bom produto entregue corretamente e antes do prazo informado.;1
