id;review_title_e_message;Satisfeito
47600;muito bom nota 10 gastei muito;1
47616;guarda chuva super prático. entrega foi rápida.;1
47640;chegou em dois dias! super rápido!;1
47656;demora no retorno demora no retorno sobre o endereço de entrega;0
47659;na foto do site das lannister é exibida uma foto do cartucho canon original, porém o produto recebido não é canon, trata-se de uma cartucho genérico de reposição.;0
47682;excelente produto e entrega dentro do prazo. recomendo a todos.;1
47692;recomendo foi uma boa compra o produto estava de acordo;1
47693;obrigada chegou corretamente.;1
47696;veio uma porcariaaaaa nao vale o preço que é ..;0
47710;super recomendo;1
47715;"comprei dois produtos, mas recebi somente um.

entrei em contato e ainda não recebi resposta";0
47732;sem declarações. apenas retirei a mercadoria no correios.;0
47737;meu produto não foi entregue ainda;0
47738;excelente;1
47751;pedido veio quebrado;0
47755;comprei o produto via telefone, e no ato da compra o produto estava disponível. após a compra fui notificado que o produto estava em falta, agora estou sem o produto e ele foi creditado na minha fatur;0
47756;o produto até entao nao chegou nao.;0
47757;a compra foi efetuada de um produto com valor x ,a mercadoria recebida foi de um valor bem inferior do que o solicitado. fiquei insatisfeita com a loja pois era um presente que eu iria dar.;0
47760;demorou muito apesar da demora produto bom;0
47783;produto e loja atenderam as minhas expectativas. ótimo produto, funcionou perfeitamente e chegou antes do prazo.;1
47795;exelente atendimento e entrega antes do prazo. eu recomendo!;1
47809;esperava um relógio maior, mas tudo bem.;1
47816;tudo certo;1
47824;perfeito  chegou antes do prazo.;1
47844;péssima loja, cobrou mais de 20 reais de frete, faz um mês que fiz o pedido e não entregou o produto;0
47857;produto entregue entes do prazo.;1
47865;eu gostei é bom produto qualidade boa.;1
47868;muito boa loja. produto dentro do esperado.;1
47931;avaliação tudo nos conformes;1
47948;problema comprei 3 unidades e recebi apenas 1.;0
47956;recomendo! produto chegou super rápido!!! tudo certo com a mercadoria.;1
47959;produto conforme o anuncio,adorei o tamanho é muito bom,chegou antes do prazo;1
47964;comprei e não recebi o produto.;0
47973;recomendo;1
47975;produto incompatível com o note book acer aspire f 15 f5-573g74g4;1
47986;adorei... excelente qualidade e custo/ benefício;1
47988;veio com defeito;0
47999;estou aguardando o produto chegar;0
48029;nao recebi o produto que pedi, o que veio foi um pouco de creme em um pote de plastico;0
48032;como sempre, entrega rápida, produto de qualidade, bem embalado e em perfeito estado.;1
48049;bom produto no momento atendendo as minhas necessidades!;1
48093;amei realizar compras junto a vcs,foram perfeito,que não mude.;1
48117;produto além da expectativa!!!!!!!!;1
48118;demorou muito tempo para chegar depois do pagamento. eu acho que pode se optimizar melhor o tempo de entrega.;1
48127;produto entregue em perfeita condições.;1
48132;não recomendo produto entregue errado, comprei um produto recebi outro totalmente diferente.;0
48135;cortina exatamente como no pedido.;1
48143;muito bom o produto recomendo;1
48168;ótimo produto;1
48175;ótimo produto, cumpre o que diz, do jeitinho do anuncio;1
48209;ótimo  simplesmente ameiiiii... produto de ótima qualidade;1
48220;relógio com pulseira quebrada. já enviado para reparos em um relojoeiro para evitar perda de tempo visto ser um produto bonito. sem embalagem, manual ou garantia.;1
48226;boa loja boa loja;1
48229;bom produto o produto chegou em perfeito estado, no momento está funcionando bem. a única observação é para a bateria que descarrega rápido. a entrega foi super rápida e me surpreendeu;1
48234;produto super confortável e muito bonito.;1
48285;paguei a vista na própria lojas lannister, demorou só para emitir a nota, depois demorou muito para começar a transportar, e ainda não recebi mesmo já tendo passado da data prevista para entrega;0
48288;ja é a segunda vez que peço esta carteira e não me entregam;0
48304;super recomendo recebi antes do prazo amei o produto;1
48307;produto chegou conforme a data prevista, e vem antes do prazo, entrega correta, recomendo.;1
48311;"perfeito ok, novinho.
ainda nao instalei.";1
48330;ótimo  adorei o produto, chegou antes do prazo.;1
48336;tudo perfeito;1
48349;muito satisfeito !!!! produto muito legal. igual à foto !;1
48354;está faltando um relogio.;0
48367;muito boa;1
48376;não consegui resposta de ninguém para saber sobre o estado da minha encomenda ou informar motivo do atraso.;0
48395;solicitei a devolução mas já se passaram as 48h e ainda não recebi retorno.;0
48414;comprei a mala vermelha e veio preta;0
48425;demora entrega;0
48429;nao recomendo o produto foi entregue porem faltando para as 2 cadeiras a peça flange assim impossibilitando a montagem do mesmo.;0
48431;muito bom, recebi antes do prazo estipulado;1
48435;produto de baixa qualidade;0
48448;comprei um produto bem mais caro e recebi um outro produto de valor bem menor e totalmente diferente do que comprei;0
48452;bom produto bonito;1
48458;parabéns ao stark.com, recebi o produto bem antes do prazo estipulado, recomendo.;1
48469;"tudo que eu compro chega bem antes do prazo. esse era pra chegar dia 05/02 e recebi dia 16/01.
super recomendo!";1
48475;produto entregue muito rápido. fiquei muito satisfeita!obrigada.;1
48482;a avaliação na minha primeira compra, foi ruim.;0
48489;recomendo excelente produto, chegou rapido e alem das expectativas.;1
48493;houve problema com o envio, fiz o cancelamento quando o produto estava voltando para o vendedor, e não tive o retorno ainda, voltei a cancelar e estou guardando.;0
48494;muito satisfeito;1
48500;quantidade errada a loja deveria prestar mais atenção nos ítens do pedido antes de enviar ao cliente.;0
48541;"o prazo não foi comprido!
ainda aguardo entrega do produto.
não tenho nenhuma informação sobre a entrega.
decepcionado!";0
48545;produto entregue dentro do prazo e com as especificações da compra corretas, porém me decepcionei qdo vi o tamanho dos adesivos, sendo pra queimar gordura da barriga e mede apenas 7,5x5cm é minusculo;0
48548;bom bom;1
48553;melhor que esperava adorei o produto;1
48572;o tapete não é de qualidade, muito inferior!!!;0
48581;gostei muito,melhor do que eu imaginavam.;1
48583;não recomendo  o jogo de cama imperial lençol king 4 peças não veio.;0
48593;até o presente momento foi recebido apenas a base do bebê conforto.;0
48602;bom;1
48611;entrega muito atrasada;0
48615;estou muito satisfeito produto original entrega me surpreendeu antes do prazo nota 10 obrigado.;1
48627;muito bom gostei recomendo;1
48637;chegou bem;1
48649;dez ótima;1
48662;só achei q o urso da bolsa era desenhos na própria bolsa não tecido colado. pq.olhando no saite parece ser do próprio coro;0
48672;entrega rapida produto como prometido;1
48675;ótima compra! amei a valvula e a entrega foi super rápida, veio com uma pequena marca na borda, mais mesmo assim vale muito apena! ficou linda!;1
48686;ótimo entrega antes do prazo. produto ótimo.;1
48693;entrega no prazo enrrega no prazo determinado;1
48723;muito bom! gente recebi meu relógio em 2 dias, muito rápido, o produto certinho, estou muito satisfeita.recomendo!;1
48725;até hoje não recebi o produto, por isso não posso recomendar essa loja, por enquanto.;0
48746;muito bom eu recomendo super recomendo;1
48754;ótimo produto péssima ent o produto é excelente, cumpriu minhas expectativas , porém a entrega paguei caro no frete e tive que buscar nos correios uma falta de respeito, quero meu valor do frete de volta , estou aguardando !;0
48757;o vendedor não tinha o produto pedido cancelado;0
48761;a entrega foi feita em apenas 3 dias. a mochila é simples, chique e muito resistente.;1
48762;do produto ainda é cedo para avaliação, mais a entrega foi ótima.;1
48773;"adorei a minha encomenda.. chegou bem antes do previsto.. 
aprovadissimo.";1
48775;"recebi meu produto antes do previsto!!!
obrigada";1
48777;produto chegou corretamente, antes do prazo;1
48782;maravilha tudo perfeito;1
48808;amei os produtos!;1
48827;regular demorou muito a entrega;0
48841;chegou no prazo e o material do produto é de ótima qualidade.;1
48878;produto chegou rápido, sensacional.;1
48884;as toalhas não parece nada com a que eu vi na televisão;0
48893;quero saber quando o meu produto vai chegar ate agora não me entregarão e ja passou da data de novo;0
48943;entrega super rapida, produto excelente!;1
48981;produto excelente, aprovadissimo.;1
48984;ótimo  produto de boa qualidade, gostei muito! e a entrega a mais rápida, antes do prazo determinado! recomendo .. ????????;1
48987;atrasou;0
48994;só não gostei pq tive que ir buscar no correio;0
49005;não recebi o produto e depois me falaram que meu vale de reembolso já estava disponível, mas era mentira, não liberaram nada. esta loja só fica me enrolando.;0
49007;otimo produto mto bonito e de mta qualidade .;1
49046;produto entregue dentro do prazo, expectativa superada.;1
49049;cortina linda! amei, irei comprar outras cores!;1
49058;otimo;1
49065;houve problema na entrega (correios), o qual foi solucionado, sem que excedesse o prazo previsto.;1
49079;perfeito no compromisso.;1
49087;a entrega dos produtos foi muito confusa e fora da data.;1
49095;???;1
49100;bem antes de prazo.;1
49101;o produto poderia ser embalado as partes estofadas brancas vem sem nenhuma proteçao ou embalagem soltas com ums papelao.;1
49102;pago a 30 dias e o produto não foi entregue!;0
49114;muito bom;1
49115;demorou muito a entrega, sendo que o frete foi caríssimo.;0
49127;otimo;1
49166;ainda não recebi o produto!;0
49173;lindas;1
49181;bom produto atende o objetivo, porém a porta hdmi 2 apresenta falha na imagem ao ligar o hdmi do notebook.;1
49185;"entao...nunca tive problemas com minhas compras...porem deste vez deixou a desejar ou seja estava agendado para ser entregue na seguinte data; 26/12/2017. ate agora nada!!!";0
49190;sem nenhuma explicação o pedido foi cancelado;0
49215;"correu tudo bem com a compra. o único ""problema"" foi que durante o pagamento não dá pra saber que a entrega é pelos correios, e a embalagem veio bem amassada. preferiria transportadora particular.";1
49228;muito bom. adorei.;1
49233;excelente excelente atendimento recomendo a todos;1
49260;eu apenas pensei que o relógio era maior, mais gostei bastante mesmo assim.;1
49268;a entrega teve 3 dias de atraso conforme a previsão. não recomendaria porque o pedido foi feito dia 21/12/2017 e só recebi dia 20/01/2018, ou seja, 30 dias. acho que a espera foi muito longa.;0
49270;meu pedido  estou aguardando meu pedido,mas recomendo sim;1
49280;gastei muita passagem depois de pagar frete, passagem e uber tá faltando 1;0
49290;ausência de informação  ausência de informação sobre o produto induz à compra incorreta. com a ausência de informação sobre tamanho da camiseta induz a pensar que seja tamanho único. o produto recebido no entanto, era p.;0
49296;bom! confesso q fiquei receosa por não conhecer o parceiro ...mas a mochila chegou bem embalada e antes do prazo. e é exatamente como na foto.gostei bastante.recomendo.;1
49328;nota 10 parabéns pela loja. ótimo produto, ótimo preço, ótimo prazo de entrega.;1
49333;recomendo  a princípio fiquei com receio por não ter nenhuma avaliação aqui, mas pesquisei mais informações sobre a empresa e comprei e super recomendo. o aparelho chegou com 10 dias e veio sem nenhum defeito.;0
49338;xxx xxx;1
49346;atendeu minhas espectativas;1
49348;sé melhorassem o tempo de entrega para região norte tenho sertesa que aumentariam as vendas é teriam clientes muito mais satisfeitos. obrigado é até próxima.;1
49351;"chegou super rápido, antes da data prevista. produto ótimo, muito bom o acabamento...
perfeito...";1
49367;7 não gostei porque tive que busca no correio nem entregaram na minha residência;0
49376;comprei três colchas no mesmo pedido, chegou apenas uma. não tem um canal de apoio ao cliente adequado.;0
49382;recomendo tudo ok, produto de boa qualidade;1
49392;"consta do histórico de rastreamento da entrega que eu recusei receber o produto.
como assim ??!!
absurdo !!! o produto não chegou !!!";0
49406;muito satisfeito recebi antes do prazo, a entrega foi super rápida. obrigado!!!;1
49410;recomendo quadros excelentes com ótimo acabamento.. satisfeita;1
49432;super recomendo, é exatamente como pensei, chegou com 9 dias antes. parabéns baratheon.;1
49433;"amei ?? a fonte, superou minhas espectativas, é muito linda .
veio muito bem embalada. recomendo essa loja.";1
49475;péssima estou aguardando a mercadoria até hoje já paga pelo cartão;0
49480;recebi o produto bem antes do prazo. ainda não foi testado, pois, é presente e não foi entregue.;0
49486;muito bom! gostei da rapidez do atendimento e o envio do número para rastreamento.;1
49487;produto ótimo. ótima qualidade, muito confortável e aconchegante. meus felinos amaram.;1
49495;recebi aquela frigideira de revestimento preto, que tem valor inferior. imediatamente solicitei a troca, porém o produto correto não estava disponível. mandaram qualquer coisa no lugar sem me consult;0
49503;realizei a compra de duas unidades dessa luminária pendente, recebi somente uma unidade, na entrega recebi a nota fiscal com a quantidade de duas.;0
49523;recomendo  a imagem da pintura é perfeita, igualzinha do anúncio. porém, achei o material pouco resistente e não tem acabamento nas bordas das peças. mas é lindo!;1
49543;recomendo produto entregue antes do tempo indicado.;1
49559;o produto veio diferente do pedido original,comprei um modelo e me enviaram outro,não fiquei satisfeita com a compra.já fiz a reclamação com a lojas lannister.;0
49580;é um kit bom de qualidade, no entanto o pincel de esfumar é muito magrinho.;1
49587;super recomendo produto em perfeito estado! conforme o anuncio!;1
49619;recomendo;1
49628;super recomendo amei vou comprar um pra minha prima;1
49635;muito bom;1
49641;otimo;1
49646;botei meu dinheiro fora comprei um papael de parede e o produto é muito ruim, não cola e olha que no anuncio avisa que a parede não precisa ter massa corrida entoa comprei rasguei dinheirooooo.;0
49669;bom gostei do produto e da rapidez ao ser entregue, mais não fiquei satisfeita pela embalagem que veio achei muito fuleira pois a caixa do casio veio toda amassada e de péssima qualidade.;0
49675;foram pedidos 2 unidades e recebemos só 1;0
49691;ótimo rápido no envio;1
49706;confio no baratheon;1
49711;ótimo produto e serviço o produto chegou bem antes do prazo e era exatamente o anunciado.;1
49736;entrega e produto conformes. no entanto, a tesoura é muito pesada e estou solicitando devolução para compra de uma menor e mais leve.;0
49741;até agora estou satisfeito, parece bom, recomendo!;1
49772;zero não entregaram e não dão satisfação! vou devolver;0
49795;amei o produto;1
49798;recebi o produto antes do que esperava. vcs são incríveis!;1
49810;tapete maravilhoso;1
49812;10 tudo 10 muito obrigado;1
49815;????????????????;1
49818;ok cem por cento;1
49844;ótimo produto é boa qualidade.... indico para todos comprar hein;1
49859;ja recebi os outros produtos, que comprei junto com esse. mas esse ainda nao chegou.;0
49867;"o produto chegou antes do prazo esperado.
estou muito satisfeita";1
49872;menor preço e entrega super rápida.;1
49874;ótimo eu sou cliente das lannister, e sempre fui bem atendido, o produto sempre chega em perfeitas condições, e antes do prazo, recomendo.;1
49877;recebi duas cartas pelo correio avisando que o produto seria entregue e até o momento nada foi entregue.;0
49912;cancelamento recebi o produto no dia 09 de maio diferente do que tinha pedido e fiz o pedido de cancelamento no dia 11 de maio e até o momento não obtive retorno algum, alias não sei mais o que faço, só procon;0
49914;entrega antes do prazo, produto de acordo com a imagem no site!;1
49919;infelizmente nao foi entregue os pendulos.....;0
49954;ótimo!;1
49961;entrega bem antes do prazo extipulado;1
49968;loja lannister sempre surpreendendo com as entregas, super rápida parabéns pelo comprometimento com nós clientes.;1
49977;surpresa! foi inacreditável qdo fui atender ao chamado do correio. tínhamos um prazo de até 20/08 para o recebimento. chegou em 3 dias. parabéns!;1
49987;bom produto bom produto, frete caro.;1
49992;sou cliente. recomendo.;1
49993;bom dia. recebi o produto no prazo. porem fora da validade. produto vencido. decepcionado com vocês. o lápis pinta cara vencido pode ocasionar alergia no rosto da minha filha. o que vocês irão fazer?;0
50015;recebi o produto dentro do prazo, porém não entregaram em minha residência, tive que retirar no correios.;0
50024;é bonito, mas o material é bem frágil. não recomendo.;0
50044;fiquei muito satisfeita.;1
50062;"recebido em ordem, bem embalado e no prazo.
gostei muito!";1
50071;muito bom.;1
50073;"apesar do atraso da greve dos correios, meu produto foi entregue bem antes do prazo.
satisfeita com minha compra e qualidade do produto.";1
50075;ótimo  entregue no prazo é de ótima qualidade.;1
50088;bom  gostei bastante do mouse, é bonito de modo geral e bem leve. porém, achei o material bem fuleiro, aparenta quebrar facilmente, mas funciona bem.;1
50089;gostaria de saber quando chega minha encom;0
50096;veio rápido e atendeu minha necessidade;1
50101;pessimo vendedor, foi entregue parte do pedido, e os que vieram são errados, comprei 60xl color veio 60xl preto;0
50108;super recomendo;1
50111;"onde eu moro os correios sempre fala que zona de risco,isso atrapalha muito a entrega de qq produto. 
o prazo era pro dia 27/12,se não fosse por isso tinha chegado bem antes.";1
50145;super recomendo chegou no prazo;1
50149;"as medidas não correspondem às descritas na informação do produto. tendo 2cm a menos na largura e comprimento. 
 quanto aos puleiros externo não tem um encaixe adequado dificultando a fixação.";0
50150;"caneta tinteiro crown satisfeito 100%; recebi bem antes do prazo estimado; só falta testá-lo (não acompanha o cartucho de tinta)";1
50158;mo produto é bom, mas tem que ser melancia pequena, grande ele não tem capacidade para cortar.;0
50166;produto chegou em ótimo estado,o envio foi bem antes do previsto.recomendo.;1
50208;satisfeita! muito satisfeita! excelente produto!;1
50211;o produto chegou cheio de amassados. sequer fica estável. uma pena.;0
50214;linda , amei;1
50222;o produto veio como o combinado e no prazo certo;1
50232;muito bom  eu recomendo.;1
50261;satisfeito com o produto. perfume de um aroma muito agradável, ideal para os dias e noites quentes de verão.;1
50312;loja confiável;1
50317;estou aguardando o contato da empresa para resolver o problema da entrega faltando produto.;0
50342;entrega é produto certo.ok;1
50349;aguardando retorno da loja;0
50368;os produtos chegaram dentro do prazo mas a mesa veio com defeito. imaginei um produto mais forte. estou aguardando contado da lannister e fornecedor.;0
50393;excelente excelente;1
50410;bom;1
50432;jarra ótima para servir visitas com água, refrigerante...amei;1
50436;não entregou e não entrou em contato;0
50448;depois de quase um mês tendo pago a mercadoria, recebo um e-mail da lannister dizendo que a targaryen não tem esse produto disponível. empresa ainda não se posicionou nem fez contato para resolver.;0
50450;excelente!;1
50463;super recomendo essa loja! recebi bem antes do prazo informado e o produto é exatamente o que eu esperava!;1
50483;comprei três jogos de cama, e só foram entregues dois, tentei entrar em contato porém o atendimento eletrônico não permite,pediu p aguardar uma resposta no e-mail e o mesmo nunca foi respondido;0
50497;entrega ante do prazo e produto correto.;1
50529;o vendedor entrou em contato comigo mas não concluiu a venda;0
50535;comprei 2 rolos de cabo 4mm e até agora so recebi 1, achei estranho porque na nota fiscal veio constando 2 e so recebi 1. espero não ter dor de cabeça. nao vou recmendar a loja ate resolver a situaçao;0
50559;comprei o produto em março, praticamento quase em junho ainda não chegou.;0
50568;10;1
50571;gostei, entregue bem antes do prazo.;1
50600;bom ficou faltando o das dez toalhas..a de cinco foi entregue..estou aguardando retorno,,;0
50602;faltou as duas peças do aparelho massageador;0
50611;o colchão da cama é horrível, não vale o preço cobrado.;0
50624;boa ainda não instalei ainda...mais tive excelente indicação;1
50633;comprei o produto errado, não atentei a descrição, verifiquei a foto no site novamente e percebi que colocaram a imagem do produto, por isso pensei que era o redmi 4x e não o note 4x;0
50635;o relógio e bom mas a pulseira e podre usei um dia e apodreceu ela tive que comprar uma.pulseira nova tinha que ser de cilicone estapulseira;1
50645;não tive problema desde a compra até a entrega.;0
50657;fiquei super satisfeita pois o produto foi entregue antes da data prevista;1
50659;caixa maravilhosa, super fácil de montar, chegou antes do prazo.;1
50698;não entregaram não recebi o produto;0
50704;ainda estou aguardando meu produto chegar.;0
50726;fiquei muito satisfeita com a compra, facilidade e entrega rápida.;1
50772;recomendo disket veio quebrado preciso manual instalacao;0
50777;o teclado não foi entregue ainda;0
50792;bom recomendo;1
50801;o produto chegou antes do prazo e isso me deixou muito feliz por se tratar de uma encomenda para criança. super recomendo!;1
50806;"produto chegou no prazo e tudo ok. recomendo.
poderiam ter enviado uma cópia da nf junto, pois a mesma foi recebida apenas eletronicamente.";1
50815;cancelamento do pedido  o produto foi comprado no começo do mês, estava quase completando a data de entrega e a empresa não tinha nem gerado a nf quanto mais entregar o produto. por isso cancelei o pedido e quero a devolução;0
50824;tudo ok;1
50825;entrego antes do prazo.produto correto e recebido sem avarias.. embalagem devidamente correta. obrigado.;1
50831;super recomendo otima;1
50832;recomendo produto chegou antes do prazo previsto, era o que esperava;1
50869;"pessimo atendimento ...depois de 1 mes da compra, entro no ""meus pedidos"" e aparece que meu pedido esta indisponivel..e muita palhacada!!";0
50872;ótimo pneus;1
50876;ainda não recebi o produto que esta parado em são gonçalo desde do dia 29/03/2018.;0
50904;produto não chegou dentro do prazo, portanto, não recomendo a loja.;0
50915;só recebi um produto está faltando o outro;0
50928;delicadinho, muito lindinho;1
50937;es poren estou aguardando uma resposta sobre a troca do produto o mesmo veio com amaçado e um pequeno aranhado na vidro;0
50939;bom bom;1
50954;excelente produto, não fica chiando, gostei;1
50958;parceria péssima prazo para entrega com + de 2 meses, acabei cancelando o produto, felizmente me devolveram o produto.;0
50981;foi entregue o produto;1
50996;loja com responsabilidade;1
51006;odiei infelizmente não fui feliz ao realizar essa compra, pois ate hoje a minha encomenda se encontra parada nas agencias dos correios;0
51013;ok;1
51026;o produto veio conforme o pedido e dentro do prazo, mas fiquei chateado pq a caixinha de veludo veio danificada, provavelmente pelo transporte. vou ter q gastar para comprar outra.;1
51044;super recomendo entrega super rápida!;1
51055;pontualidade um bom produto.;1
51067;gostei do produto, embora espera outra que seria de outra forma, a bíblia que comprei veio sem os títulos de cada capitulo.;0
51083;recomendo. td ok.;1
51087;entregaram dentro do prazo, mas meu protetor veio em parte descosturado, pena que veio com esse defeito de fabricação.;0
51102;atendimento de primeira.;1
51121;melhor do que imaginei... grande e com um designer muito sofisticado;0
51167;chegou antes do prazo e entregaram tudo certo.. só falta usar e testar..;1
51177;"produto incorreto recebi as lentes de contato com o grau errado pedi 
4,75 recebi -4,75 pedi 5,25 recebi -5,25";0
51185;muito bom o atendimento e a entrega eu recomendo;1
51198;"o produto deverá ser entregue no end fornecido, contudo, no horario das 8h às 14h, põe se tratar de órgão público.
grato.";1
51206;bom dia, infelismenti tivi que cancelar devido a situaçao em q o governo,estao colocando nos professores contratados,assim q as coisas forem resolvidadas quero comprar,mas obrigada,;1
51212;gostei só que demorou muito p chegar;0
51220;o produto chegou certinho e antes da data agendada para entrega!;1
51239;entregá  vcs estão de parabéns o produto foi entregue antes do prazo e adorei o produto indicaria com certeza essa loja obg;1
51258;muito bom gostei entrega rapida;1
51259;muito bom gostei muito;1
51274;nao recebe as cores pedidos;0
51285;chegou antes do prazo;1
51287;comprei o produto e até agora não chegou e não consigo um rastreamento certo;0
51304;bom;1
51312;apenas chegou um pendente, enviei 3 email descrevendo o ocorrido e ainda não recebi nenhuma satisfação, aguardando.;0
51327;produto de excelente qualidade muito bonito .targaryen esta de parabéns entrega antes do prazo muito bem embalado ficou lindo na minha cozinha...amei.;1
51337;nao recebi a encomenda.;0
51350;!!!!!!! estou no aguardo...;0
51363;achei muito frágio..;0
51381;otimo chegou antes do prazo. o produto é excelente.;1
51382;estou insatisfeita, porque não venho recebendo informações sobre o produto comprado e até o momento o produto não chegou!!;0
51403;nao recebi ainda;0
51404;só que comprei errado;0
51439;muito satisfeita!!!! o produto chegou suuuper rápido, super bem embalado. adorei!!! certamente comprarei mais vezes!!!;1
51443;satisfacao excelente produto;1
