id;review_title_e_message;Satisfeito
19;não chegou meu produto  péssimo;0
43;entrega perfeita muito bom. muito cheiroso.;1
51;"recebi somente 1 controle midea split estilo. faltou controle remoto para ar condicionado consul";0
55;boa;1
64;ótima loja para parceria: rápidíssima, produtos bem embalados e de qualidade! só o custo do frete que foi meio azedo.;1
116;"entrega muito rápida parabéns";1
150;comprei o relógio, unissex e enviaram um relógio feminino, bem menor que as especificações do anúncio.;0
159;ótimo custo-benefício;1
160;ok;1
163;muito boa gostei da atenção com a entrega;1
178;lindo relógio adorei;1
199;ainda não tive a oportunidade de testar;1
201;recomendo comecei a usar agora;1
207;nota3 comprar um produto correto na capa mas interno ser outro.???????;1
213;o produto chegou muito rapido e de boa qualidade recomendo o produto;1
221;não posso! estou aguardando a chegada do produto que comprei!logo que isso aconteça, terei minha opinião formada!;0
231;decepcionado;0
240;demora na entrega, detestei o atendimento e nunca mais compro. baratheon quando vendia por eles mesmos era bem melhor!;0
298;e muito desordenado comprei três produtos mais não veio no dia sertões veio separado e em data separada;0
303;mercadoria certa entregue no prazo combinado. grata;1
347;"mega recomendo recebi meu produto corretamente e dentro do prazo,verificando na caixa esta tudo correto,mas ainda não montei.produto lindo,cor perfeita,amamos. super recomendo.";1
348;a embalagem deixou a desejar, por pouco o produto não foi danificado, a caixa estava toda amassada.;0
350;recomendo.;1
374;"produto exatamente conforme descrito. chegou bem antes do prazo!";1
384;nao compro mais na lannister. se é parceiro da lannister ou não essa targaryen jamais uso novamente. quando eu ler que é dessa empresa saio correndo. um absurdo. quase um mês para entregar. extra.com ok;0
393;recomendo o pedido chegou antes do combinado, muito bom.;1
414;sempre compro no stark e sempre sou bem atendido, site eficiente e produtos de ótima qualidade, recomendo a todos podem comprar de olhos fechados!;1
424;"a bolsa e muito bonita por fora mas dentro não tem forro e é bem fragil";1
428;"produto pirata! quando instalei o cartucho de tinta, a minha impressora indicou que o mesmo estava vazio, e apresentou a mensagem de erro ""!"" em cima do marcador de nível da tinta. já solicitei a troca.";0
447;gostei!;1
490;comprei o produto na cor preta e chegou na cor vermelha.;0
497;ótimo;1
507;"so recebemos um relogio pelo correio att";0
524;recebi sim mais com defeito os encaixes sao dois igual e nao fecham;0
531;1000000 muito bom;1
532;até agora nao recebi.comprei este aparelho por questao de saude,portanto nao recomendo esta loja.;0
539;o produto chegou antes do prazo, e gostei bastante!! agora meu rapazinho de 3 aninhos vai aproveitar ao maximo!!;1
546;comprei o produto, paguei no boleto e só recebi metade do produto, anunciaram uma coisa é mandaram outra. muito insatisfeita ??????;0
547;entrega antes do prazo produto muito bem conservado.;1
548;produto de ótima qualidade. adorei!;1
551;produto e entrega ótimos apesar da demora em expedir a nota fiscal, depois de expedida a entrega foi rápida e o produto veio bem embalado. recomendo.;1
560;"comprei um produto para ser entregue por essa loja e ainda não recebi pois assim já se passou a data de entrega";0
563;veio conforme o pedido mais o pós venda não respondeu nenhuma das minhas perguntas;0
584;otima venda, tudo perfeito.;1
606;indico a loja compro sempre na lannister .;1
618;produto chegou dentro do prazo. atende pelo custo benefício, porém a bolsa não é forrada e a alça é de plástico. estou satisfeita.;1
620;super recomendado estou plenamente satisfeita com minha aquisição. e recomendo. a única coisa que não concordo é com o valor de frete. autíssimo.;1
632;parabéns ?? pelo excelente atendimento de qualidade.;1
649;o pedido chegou antes do prazo. obrigada.;1
653;o tampo da mesa chegou todo amassado e batido.;0
666;até o momento eu n recebir o produto;0
671;produto perfeito, chegou antes do prazo!;1
683;10 gostei muito , o objeto veio o mesmo comprado, já comprei em outras lojas e veio outra cor ñ gostei! com lannister tudo ok.;1
713;"comprei tapete de borracha para tr4 mitsubishi a loja entregou um tapete de pvc horrivel
no titulo ta tapete borracha tr4,
me enganaram e agora o que fazer sendo que tem despesa para devoluçao, por";0
715;gostei ótimo perfume. fragrância maravilhosa. recomendo;1
719;pedaleira plataforma o produto superou minha expectativa. o prazo de entrega foi antecipado em 7 dias. já instalei e ficou show.;1
743;entrega antes do prazo. entrega antes do prazo, recomendo essa loja.;1
757;excelente produto, bonito e sofisticado.;1
768;comprei rosa com braços brancos e entregam toda preta ?;0
775;entrega dentro do prazo, produto sem nenhum problema;1
778;boa qualidade e preço.;1
783;sempre entrega antes do prazo.;1
788;boas pessoal, a atendente da lannister foi muito atenciosa porém a loja que deveria ter me entregado o produto cancelou a comprar ??? o que será que aconteceu ???;1
803;o produto foi entregue bem antes do prazo.adorei;1
824;muito bom. já é o segundo objeto que compro e recebi sem problema nenhum;1
836;boa noite , não gostei pois nunca conseguimos falar com vcs pelo telefone;0
837;vendedor compromisso do vou o cliente;1
845;muito satisfeito entrega super rápida.. show ..parabéns.. eu vacilei e comprei um celular nas casas bahia tem quase um mês e não entregaram..;1
850;tudo cento e no prazo recomento;1
854;nao foi entregue na minha casa , por isso nao gostei , nao tenho tempo de esta indo nos correios..;0
865;minha mercadoria não foi entregue , já paguei a primeira fatura quero cancelar a compra pois paguei o frete e não recebi a mercadoria.;0
869;recebi apenas 1 caixa com 100 unidades, e pedi 2 caixas.;0
871;estou extremamente decepcionado. isso nunca havia acontecido;0
872;ótima;1
875;tudo conforme e entrega muito rápida!!!! que pena que não verifiquei a cor, pois era preta e precisava de cinza. outro ponto que tive que lixar pouco para funcionar, mas nada demais.;1
896;o cep foi escrito errado, tive que retirar o produto nos correios da cidade vizinha.;0
905;continuem assim, com essa responsabilidade com o consumidor, tanto no produto, quanto no prazo de entrega. primeira vez que compro e vou comprar muitas. obrigado.;1
907;recomendaria sim bom , foi o que esperava.;1
912;de fácil manuseio, até o presente atende as expectativas.;1
913;recomendo relógio lindo entrega antes do prazo;1
930;recebi, a bolsa é diferente mas gostei estava previsto pra 31 de janeiro estava achando muito tempo porque é pra escola e estou aguardando o vale compra da primeira compra da bolsa que não deu certo;0
934;na propaganda está escrito mixer elétrico e veio um portátil que eu tenho três que quebrou por isso eu queria um elétrico, vocês devem especificar melhor os produtos;0
938;produto entregue antes do prazo combinado. não é a primeira vez que compro pelo site lojas lannister e recomendo tal empresa pela seriedade no trato com os clientes.;1
943;agradeço muito bom.;1
953;atenciosos,ligam para dar acompanhamento. bom prazo de validade. demorou de chegar. agora é verificar a qualidade do produto.;0
955;muito eficiente entregou bem rápido eu recomendo;1
960;chegou antes da data do prazo, porem vazou um pouco do produto!;1
973;produto entregue antes do prazo em ótimo estado.;1
992;tudo ocorreu de forma eficiente;1
999;o produto não corresponde ao que eu comprei, a película é muito menor que a tela do celular e não cobre toda a tela.;0
1000;produto conforme anunciado, e veio antes do prazo...perfeito;1
1001;produto entregue produto bom e entregue antes do previsto.;1
1011;não recebi o braço de ducha com desviador, somente a ducha 20x20 com braço de 30cm.;0
1012;ótimo adoro comprar nas lojas lannister;1
1026;muito bom;1
1057;recomendadíssimo fui surpreendido pela eficácia. ótimo atentimento.;1
1085;"não recebi o produto completo, comprei quantidade 02 e recebi somente 01. e consta na nota da entrega tem quantidade 02 e com volume 01.
quero receber a outra sem custo nenhum. pois o erro não foi me";0
1099;o produto é de muita baixa qualidade;0
1101;produto entregue bem embalado ,em perfeitas condições.;1
1104;a compra efetuada foram dois ursos que rezam, um rosa e um azul, recebi somente um dos produtos que adquiri, o rosa, estou aguardando retorno do vendedor, sobre o que ocorreu e se vou receber o outro;0
1110;produto bom gostei muito;1
1113;poderia ter agilizado com a entrega! porém recebi o produto em ótimas condições!;1
1118;produto de excelente qualidade e a entrega foi feita antes do prazo previsto. muito satisfeita.;1
1122;o produto veio sem nota fiscal, tive que solicitar pelo telefone.;0
1124;o produto não é bom.;0
1141;muito bom , exelente;1
1156;"satisfeito com a compra satisfeito com a aquisição e negócio.
entrega no prazo, com produto bem embalado, com a nota fiscal, caixa original, garantia e manual do usuário.
primeiras impressões o relógio está em perfeito.";1
1189;o quadro foi entregue pelos correios e chegou com uma madeira atrás quebrada e a tela do quadro danificada afundada...ou seja...chegou avariado o produto;0
1204;ainda não recebi;0
1220;o produto demorou um mês para ser entregue . tempo demais poderia ter chegado antes da data limite. fora isso tudo ok.;1
1226;só acho que poderia ter comprado mais cartuchos, mas não as fiz porque cada cartucho veio em um frete diferente, coisa que poderiam ser colocados em um único pacote, o que baratearia o frete.;0
1246;quero saber dos demais produtos eram 3 itens;0
1249;parabéns;1
1252;não posso dar opinião sobre produto pois não recebi, sobre a loja eu não recomendo, pois atrasa as entregas.;0
1269;lavabo bem bonito e igual a descrição, veio com uma mancha bem pequena, mas nada que seja um problema, recomendo.;1
1271;produto entregue totalmente diferente do comprado;0
1282;aida nao recebi o produto;0
1287;depende para que eu possa avaliar se resolverem meu problema pos a compra era 4 os correios só entregarão um pacote contendo 2 peneus;0
1304;recomendo tudo ok.;1
1329;o produto veio fora da especificação. a calota vendida tinha o símbolo da citroën, mas a calota veio sem este símbolo.;0
1352;excelente produto e a entrega chegou antes do prazo previsto!!! ótimo;1
1359;gostei muito do produto nao tem ardencia nos olhos e nem cheiro alisou 90% fos meus cabelos mais acho que da segunda vez ficara super liso.;1
1388;esclarecimento boa noite na compra diz wireless 150mbs multilaser mais 3g não teria que vim o modem 3g que conecta no usb nele.;0
1410;eu recebi desta loja apenas dois pendentes. paguei o boleto antecipado e um produto não veio: trata-se de um pendente em alumínio meia bola medio escovado no valor de r$ 90 . quero $ de volta.;0
1422;além de ñ cumprir com o prometido no caso aentrega a loja ainda dá esclarecimento errado informado que o endereço está errado;0
1434;rapidez na entrega.;1
1438;mas esta demorando muito desta vez.;0
1446;bom, a resma chegou muitobem embalada, dentro do prazo e afora vamos testar para verificar a qualidade do papel.;1
1455;super indico maravilhosa;1
1461;defeito o produto chegou bem antes do prazo, mas com defeito, veio quebrado o lugar de fazer o encaixar. muito bonitinha, mas frágil. tentei realizar a troca pelo site e não consegui.;0
1463;ainda nao recebi e a ultima informacao sobre p produto e do dia 08/12/2017.;0
1464;o película de vidro veio com defeito e não estou conseguindo resolver o problema.;0
1477;recomendo.;1
1494;não é original, infelizmente o pós vendas da stark é extremamente ruim, pois já entrei em contato e até agora nada, aí consegui ligar para o fornecedor parceiro que já devolveu o dinheiro.;0
1503;cumpriram...;0
1513;não recebi o produto não recebi uma justificativa do vendedor. entrei em contato mas até agora não obtive uma resposta.;0
1528;adorei veio certinho muito obrigado;1
1534;o correio nao entregou no endereço, tivemos que retirar, a caixa estava aberta e a churrasqueira amassada;0
1540;ótimo;1
1543;agilidade chegou super rápido e bem embalado.;1
1545;melhor site de compras pela internet!;1
1552;bom acabamento não instalei ainda;1
1553;recomendo muito bom chegou antes da data prevista, tudo ok;1
1558;foi boa a compra recomendo;1
1592;já solicitei devolução do produto. veio amassado, parece que houve uma queda;0
1602;o mp3 player é muito bonito e pequeno. contudo, o som dele é muito ruim, com ruídos e chiados. troquei o fone de ouvido pelo da apple, mas não mudou nada. o problema é na qualidade do produto mesmo.;0
1607;ainda não instalei mas chegou no prazo certinho!!;1
1614;troca / devolução a experiência de compra on-line e a entrega foram boas, porém o produto não atendeu às expectativas e estou tendo dificuldades com a troca /devolução.;0
1631;ótimo tapete lindo e personalizado, bordado em volta e com o logo classic, todo de borracha pvc, mt bom fácil de limpar;1
1632;bom acabamento produto bem acabado ????;1
1634;comprei duas bonecas baby kiss sid nil dia 07/12/17 e eles entregaram somente 1 boneca ,não veio junto nota fiscal,caixa amassada e também não consigo contato com a lannister o telefone só da ocupado;0
1659;o produto foi entregue no prazo, até uma semana antes, porém houve um imprevisto na minha entrega, tentei entrar em contato várias vezes sem nenhum sucesso, fiquei mais de semana sem saber de nada.;0
1675;não abri a caixa ainda !;0
1683;recebi o produto de outro modelo. desatenção por parte do distribuidor :(;0
1684;gostei bastante do tecido, bem macio;1
1694;bom;1
1708;muito bom  adorei os produtos somente achei muito ruim ter de pagar 2 fretes para o mesmo produto do mesmo vendedor;1
1727;produto veio diferente  produto veio diferente ao anuncuado. liguei e só esperando o código para a devolução do produto e reembolso do valor pago.;0
1728;parabéns entrega antes da data prevista, um produto bom e barato som do produto muito bom corrir com ele não me incomodo não ficou caindo ou folgando no meu ouvido olha que corrir 8 km recomendo.;1
1761;entrega super rápida! produto de acordo com as características descritas no site! excelente!;1
1762;pensei que o defletor era uma grande placa, porém são 3 pequenas peças, que se encaixam uma na outra. sinceramente não gostei pois no mercado há opção de peça única, mais bonita e com melhor design.;1
1764;não fiquei satisfeito com o material do produto;0
1766;recomendo;1
1770;"ate agora nao revebi o produto.
espero que ao menos a pontuação tenha sido feita de acordo com a promoção.";0
1772;muito bom  entrega no prazo , gostei;1
1780;"chegou no prazo determinado, muito bem embrulhado.
estou satisfeita.";1
1784;entrega antes do previsto produto ótimo. .. chegou antes do esperado.;1
1789;perfeito.;1
1814;super recomendo chegou antes do prazo;1
1832;sempre cumpre os prazos de entregues;1
1834;ótimo  entrega rápida produto perfeito;1
1836;"você paga 2 e recebe 1 roubo! na nota fiscal são 2 unidades mas no embrulho vem apenas uma.
querem cobrar sem entregar?";0
1846;produto original, entrega rápida e bom preço!!!;1
1849;excelente  adorei o produto é a compra excelente!;1
1857;material do produto bom, porém não cabe perfeitamente.;1
1859;veio certinho e rapido boa qualidade!;1
1870;desta compra não gostei. veio um relógio feminino no lugar do relógio masculino que eu pedi, fiz o cancelamento e a devolução do que eu recebi e também sobre o estorno e não recebi nenhuma resposta.;0
1891;muito bom produto chegou bem antes da data prevista;1
1898;super recomendo a loja. produto entregue muito antes do prazo e de excelente qualidade.;1
1907;rápido e preciso. excelente loja...envio rápido e produto certo.;1
1937;otima  sistema operacional de compra fácil de ser manuseado e compreendido. entrega rápida e o metros comprado corresponde com o da propaganda. compraria novamente .;1
1945;entregaram os produtos, mas, não cumpriram o prazo de entrega passou do prazo.;0
1946;o produto é ótimo e original recomendo.;1
1948;minha compra veio pela metade , comprei uma capinha de celular e uma película de vidro somente veio a capinha a película não veio;0
1952;demora, produto nao entregue!;0
1965;entregue bem embalado;1
1977;recebi o produto com cx aberta , sem lacre, sem nota fiscal, sem pedido de compra e com remetente diferente do anuncio. quero devolucao do dinheiro. descontentamento;0
1980;produto de ótima qualidade.;1
1983;foi entregue uma quantidade do produto. sendo que pedi duas quantidades;0
2015;chegou tudo certo, recomendo.;1
2016;ótimo;1
2018;otima loja;1
2022;recomendo  chegou bem rápido e parece ser bom, só vou descobrir com o uso, a capa para o sofá de 3 lugares veio um pouco menor a largura veio 1,46, mas a de 2 lugares veio no tamanho certo.;1
2037;gente ainda não recebi minha encomenda. como fasso pra vocês enviarem de novo;0
2049;recomendo  ótimo, produto certinho, entregue dentro do prazo, tudo ok.;1
2054;material muito bom;1
2059;ótimo produto;1
2099;produto entregue antes do prazo,muito satisfeita.;1
2100;comprei a capinha, paguei o frete caro e quando recebo o produto não veio a cor na qual eu havia comprado. decidi não devolver, pelo custo adicional e demora na entrega do produto correto.;0
2119;lojas de altamente de qualidade;1
2159;material de boa qualidade e bonito..só achei que fosse maior!!!;1
2160;produto enorme e confortavel.;0
2195;tudo dentro do combinado;1
2199;comprei com a voltagem 220 e veio 110v;0
2208;tudo ok;1
2222;"produto com defeito 
comprei um produto que está com defeito e não consigo trocar da erro no site.";0
2225;chegou em perfeito estado e antes do prazo previsto. obrigada pela rapidez.;1
2257;recomendo  sempre comprei e não tiver problema, porém dessa vem sim meus produtos não chegou até agora;0
2259;tudo dentro do esperado, a não ser o correio que trouxe a embalagem parecendo estar atropelado por um trem, tive de pessar os tres produtos pra ver se tinha perda, pois estava vazando.;1
2288;data prevista para entrega 17/5, estamos com urgência desse produto e nada.;0
2304;"bom o produto é bom a entrega é rapida;mas frete muito caro.";1
2311;a compra foi feita e entregue no prazo. recomendo a loja e o site da lannister.;1
2345;a empresa prestou ótima assistência, o produto chegou em ótimo estado.;1
2366;horrível  comprei uma coisa e me entregaram outra e não consigo fazer a troca e não consigo falar com a central !;0
2367;parabéns a está empresa então site lannister.com.br obrigado;1
2368;gostei muito do produto.;1
2379;super recomendo;1
2403;produto de otima qualidade chegou rapido;1
2422;não chegou  eu pedi dois kit e só chegou apenas um o outro não chegou;0
2445;recomendo muito bom . amei o produto ,é lindo muito bem feito..chegou bem rápido.;1
2485;amo comprar nas lojas lannister. parabéns estou satisfeita obrigada por tudo bjks ficam com deus ??????????????;1
2487;entregue antes do prazo;1
2493;tudo certo;1
2498;caneca fera do timão, mais uma pra coleção;1
2529;estou aguardando posicionamento da loja sobre a entrega;0
2575;otimos produtos otima entrega só elogios;1
2576;bom recomendo a compra nessa loja.;1
2577;eu gostei muito que entregaram antes do prazo e deu tudo certo!;1
2579;excelente  super recomendo;1
2580;achei ótimo só achei o tecido misto fino mas no geral é bom custo benefício !;1
2595;a caixa veio bem amassada parecia um produto usado um dos dvds chegou com a caixa quebrada, (a borda), os outros vieram lacrados, mas tinha um brinde.;0
2600;muito ruim comprei 6 cartuchos, recebi apenas 4 unidades após o prazo de entrega, e ate hoje estou tentando entrar em contato para uma solução, mas sem sucesso.;0
2602;ótimo;1
2625;produto aparentemente bom.;1
2643;os quadros são lindos, bem acabados. amei!;1
2665;chegou antes do tempo previsto, lindo e perfeito o relógio ... minha amiga decretação adotar;1
2696;7;1
2715;"composição diferente na descrição do produto é indicado que o mesmo possui tecido superior e inferior de 100% algodão, mas na verdade são 80% algodão 20% poliéster.
propaganda enganosa.";0
2725;super recomendo satisfação total, produto, qualidade, prazo de entrega conforme solicitado e programado.;1
2729;"tristeza comprei, esperei, esperei e até agora nada.
ainda tenho esperança. quem sabe houve algum problema que venha a ser resolvido.";0
2746;o problema não é com a loja mais sim com o produto tem que deixar carregando o dia inteiro pra ouvir meia hora de música e não funciona enquanto carrega desliga sozinho.;0
2757;deveria melhorar o prazo. demora muito tempo para entregar a mercadoria. o produto permaneceu alguns dias parado e já podia ter sido encaminhado.;0
2764;material entregue em um pacote de papel kraft,recebi a mercadoria com o pacote todo aberto e rasgado.este tipo de empacotamento nao é recomendado pelos correios.;0
2765;só tive problema com correios, embora chegou no prazo, mas era pra te chegado bem antes.falando do produto, tô muito satisfeito superou minhaa expectativa.targaryen baratheon tão de parabéns.;1
2767;excelente produto muito lindo amei;1
2780;recebi o produto corretamente.;1
2786;excelente produto.;1
2823;nao foi o esperado no mostroario e um e o produto e outro;0
2842;foi uma decepção!!;0
2844;chegou rápidinho e em perfeito estado. recomendo;1
2852;produto perfeito;1
2855;a colcha que eu comprei vinha com 03 peças, e essa só veio 02 peças , 01 colcha ,e 01 porta travesseiro!então no caso ficou faltando o porta travesseiro!então eu aguardo uma resposta do vendedor;0
2866;foi rápido a entrega;1
2918;otimo recomendo...;1
2921;entrega muito rápida ainda não utilizei o produto então não posso opinar sobre o mesmo. contudo recomendo a loja, recebi o produto de forma extremamente rápida.;1
2926;foi a segunda vez que tentei comprar com essa loja e o pedido não foi entregue no prazo.;0
2936;mini receptor de tv digit produto excelente, preço melhor ainda, entrega no prazo. perfeito!;1
2955;otima adorei o produto;1
2957;já recebi, só que o lg k10 esta demorando, estou na espera do mesmo... pois comprei antes da pelicula. valeuuu;0
2964;atendimento perfeito. produto chegou antes do previsto.;1
2973;cadeira chegou em perfeito estado. muito boa!;1
2974;ótimo produto e chegou bem rápido.;1
2982;amei;1
3010;bom;1
3012;"parabéns 
produto é entrega
nota 10";1
3023;"adoro comprar nas lojas lannister.

os produtos são de ótima qualidade.";1
3039;comprei 02 jogos de lencois de cetim e uma colcha, mas até agora só recebi o jogo de lencol cor cobre. o que houve????;0
3043;"a quase um mês foi feito o pedido do relógio e pago via boleem se quer to e até agora nada. mandei dois emails e nem se quer me deram satisfação; lojas oslit pra mim ta fora. lannister sem prestigi";0
3046;meu produto não chegou até hoje, e preciso dele para sábado, sem falta. ou seja, a entrega precisa ser feita até sexta feira, dia 27/10/2017.;0
3065;nota 10 meu produto foi entregue antes do prazo estipulado, chegou em perfeito estado, bem embalado, estou bem satisfeita, recomendo!!;1
3082;excelente!;1
3093;a pensar recomendação comprei um produto e me enviaram outro similar sem me perguntar se eu queria a troca;0
3114;ótimo vendedor, recomendo!;1
3135;super recomendo;1
3160;foi entregue no prazo, sem problemas.;1
3164;chegou antes do prazo, parabéns!;1
3171;recebi antes do prazo;1
3190;recebi o pedido corretamente, porém o mesmo não veio acompanhado da nota fisca;0
3199;infelizmente o cartucho não deu na impressora canon mg3510;0
3200;vcs deveriam mandar o manual em português recomendo.;1
3210;otimo!;1
3223;comprei um tapete de 2x2.5 e recebi um de 2x1.5. nas lannister não há a opcao de troca do produto errado, só ressarcir no cartão ou trocar por vale. no site havia ainda anúncio do que comprei.;0
3228;a case de tablet veio perfeita. o suporte de tablet veio com defeito no encaixe, alem de ser um produto muito frágil para segurar um tablet caro! a entrega foi muito antes do prazo.. a loja impecável.;1
3252;embora tenha havido problemas com a entrega pelos correios o produto chegou.;1
3260;"entrega rápida e qualidad entrega rápida e produto de qualidade.
recomendo.";1
3262;maior do que imaginava, mas é muito moderno e lindo. vai deixar linda a minha decoração da sala.;1
3277;não veio na cor q eu fiz a compra;0
3285;o produto chegou bem antes do prazo estimado. em relação a qualidade, esperava ser um pouco melhor, mas é muito bonita....;1
3288;ainda não recebi minha en ao efetuar rastreio consta em trânsito a 19 dias;0
3300;excelente ótimo produto. entrega antes do previsto.;1
3301;mercadorias bem embaladas e entregues no prazo estabelecido.;1
3310;entrega muito rápida.  produto de um ótimo acabamento recomendado.;1
3326;ok.;1
3332;só não consegui achar a descrição do produto no site. esperava que as bolsas fossem maiores do que realmente são, assim atenderiam minha necessidade.;1
3333;comprei 15x13 e me mandaram 13x18. inútil pra mim, usei a ferramenta do stark pra entrar em contato e até agora ninguém me respondeu.;0
3355;"marerial
de qualidade.. o tamando
ficou perfeito";1
3365;funcionou perfeito;1
3370;até o momento não recebi o produto;0
3393;não quero avaliar;0
3406;fiquei satisfeito , quando comprei não gostei do prazo de entrega , mais tudo ok, chegou bem antes;1
3408;não comprem essa película. não cola. veio ressecada a cola ou algo do tipo, atrapalha no touch screen.;0
3448;o fone chegou em perfeito estado e muito rápido!;1
3462;muito bom como mostra a descricao;1
3473;muito boa recomendo e um bom produto;1
3479;excelente;1
3504;produto de qualidade, pontualidade foi fundamental, recomendo a todos.;1
