id;review_title_e_message;Satisfeito
73778;estou aguardando o produto até agora, afinal já foi pago;0
73787;o produto nao foi entregue pois no endereço constava numero 171 e na realidade é o 170, isto não justifica a nao entrega,;0
73791;lindo o produto perfeito...;1
73805;comprei dois produtos e recebi apenas 1 deles. tentei entrar em contato com a loja e não obtive sucesso. tentei entrar em contato com a lannister por telefone e email e também não consegui.;0
73808;tive a impressão de que o produto era maiorla quando estava com ele em mãos pois no site era diferente mas gostei do produto. ..super recomendo essa loja muitos precisos na data da entrega;1
73812;tudo ok e dentro do prazo;1
73824;recebi a mercadoria danificada e estou aguardando que o problema seja resolvido da melhor maneira possivel;0
73827;encaminhou produto vencido e não respondeu minha reclamação;0
73833;lindo!!!ótima qualidade!!!;1
73835;o tour do celular é lento. demora ao responder. a empresa não aceita devolução? foi isso que eu intendi?;0
73836;produto chegou antes do prazo, conforme solicitado e em perfeita condição. ótima negociação e compra. recomendo a compra do produto.;1
73850;achei um absurdo cobrar 20,00 de frente e eu ter que ir buscar meu produto numa sede dos correios muito longe da minha casa, prefiro quando a entrega é feita por transportadora.;0
73852;recomendo loja nota 10;1
73858;comprei o produto e depois de 45 dias, a loja americana enviou e-mail dizendo: devido a uma divergência no sistema de controle de estoque do parceiro , não será possível efetuar a entrega do produto;0
73870;as lentes estao com defeito nao sei se a cx toda;0
73881;produto muito bom. o atraso não foi por culpa do vendedor e sim dos correios.;1
73925;ótimo excelente;1
73937;amei adorei, são lindas!;1
73967;bom;1
73970;ótimo produto!  atendimento nota 10.produto excelente.;1
73971;excelente!;1
73991;muito bom. super recomendo, e o produto chegou antes do prazo combinado que é melhor ainda!;1
74005;chegou muito antes do prazo recomendo;1
74008;super indico o site,... entregaram bem antes do prazo indicado na compra!!!;1
74009;tudo dentro da normalidade;1
74016;sem comentários;0
74021;o produto veio dentro do prazo e em bom estado.;1
74034;"vocês foram rápido na entrega muito obrigado a todos vcs ,eu sempre vou recomentar essa loja as minhas amigas e família 
.
 grata: maria elaine.";1
74078;a entrega poderia ser mais rapida.;1
74079;o produto foi entregue conforme combinado. funciona perfeitamente.;1
74096;comprei um cesto joaninha e recebi um de pintinho....;0
74127;recomendo demorou um pouco a chagar o produto, mas foi dentro do prazo.;1
74133;recomendo chegou bem antes do prazo estimado, muito bom!!!;1
74137;lindo recebi o produto antes do prazo estabelecido e é muito lindo. serviu muito bem em meu pulso, que é muito fino.recomendo esse produto sem dúvida. ótimo para presentear. fica a dica.;1
74148;pedido recebido corretame o produto chegou até antes do prazo estipulado.;1
74166;o produto ainda não chegou.;0
74168;"entrega parcial do pedido comprei 2 hds de 1tb ssd, porém só foi entregue uma unidade ate o momento.
aguardando um retorno com urgência.";0
74183;produto ruim o mocho não tem nem 6 meses de uso e a parte da estrutura já está rachando! produto de péssima qualidade!;0
74188;satisfação completa produto chegou bem embalado e no prazo. obrigado a todos.;1
74190;zero como diz que entregou a mercadoria sem ter entregado só se entregou em lugar errado aqui no endereço correto ninguém recebeu nada e assinou nada.;0
74197;comprei dois cartuchos da hp no dia 25/02/18 até agora não recebi.;0
74251;produto pedido estava esgotado. porém a loja entrou em contato, foi super atenciosa e enviou outro produto de minha preferência.;0
74254;não recebi ainda, falarei sobre o produto quando recebê-lo.;0
74257;excelente;1
74262;produto incompleto ao abrir a embalagem somente constava os cestos e os pés da fruteira não vindo toda a estrutura de madeira. gostaria que verificasse o ocorrido.;0
74264;bom produto o produto foi entregue antes do prazo, era encomenda para um amigo, que gostou bastante.;1
74278;otimo;1
74285;produto divergente  adquiri o produto c rodízios, entendi q fosse c 4 rodas de apoio no pé. porém recebi o gaveteiro sem as rodinhas, com o apoio dos 4 pés estáticos.;0
74288;era pra ter chego até o dia 06/06/2018, já fui no correios e nao esta la.;0
74308;comprei duas tampas de cooktop e só recebi uma,fiz uma ocorrência ontem por telefone,recebi o protocolo p email e o atendente falou que o fornecedor do produto irá entrar em contato em até 2 dias útei;0
74321;boa material entregue corretamente e no prazo.;1
74325;só ficou pequena, futuramente pedirei uma maior se tiver;0
74330;ñão recebi o produto adquirido;1
74340;das 6 taças compradas recebi apenas duas. estou aguardando solução para o recebimento das restantes.;0
74348;nao recebido produto  sem o produto nao recebido;0
74356;adorei entrega rápida e eficiente;1
74357;"pelo código de rastreio que foi disponibilizado pra mim diz nem chegou na unidade do correios do meu município
já passou do prazo de entrega.";0
74365;super indico ótimo atendimento, entrega antes do prazo, produtos maravilhosos!!!;1
74368;não recebi e é outro produto das minhas compras que não me entregam ! estou começando a ficar irritada e estressada pelo atraso absurdo !! deveriam chegar no prazo se os correios não dão conta troquem;0
74369;super recomendo recomendo.;1
74378;eu sempre comprei na lannister e sempre recebi na data certa mais esse ano estou vendo que minha filha vai ficar sem o presente do papai noel vou espera ate quinta dia 21 se nao vou cancelar .;0
74380;minha mercadoria não chegou ainda pq ??;0
74402;stark sempre me satisfazendo , como e recomendo sempre !;1
74403;muito bom. redomendo;1
74405;primeira tentativa de entrega, não havia ninguém em casa, dia 18 e 19 de abril, conforme dizia no rastreamento 2a previsão de entrega, eu estava aguardando e não foi entregue;0
74428;produto com defeito o produto nunca ligou ou acendeu nada. passou um bom tempo carregando mas nada aconteceu;0
74432;"conforme a empresa targaryen está de parabéns.falando do produto veio com defeito por isso estou fazendo essa reclamação.


já solicitei a troca da parte que está danificado que é a ( base estrela)";0
74441;100% top;1
74451;recomendo o unico senão de tudo é que o frete foi cobrado como se fosse duas entregas e foi tudo enviado em um só volume, pelos correios isso tende a reduzir um pouco o frete total. no mais tudo em ordem.;1
74464;não entregaram, não deram satisfação e já compensou no meu cartão.;0
74474;excelente!!;1
74482;produto chegou rápido, com a qualidade esperada. além de ser uma loja com preços muito bons e produtos interessantes.;1
74483;confirmado entregue dentro do prazo.obrigada;1
74486;super recomendo;1
74490;tudo perfeito;1
74500;produto chegou dentro do prazo. qualidade compatível com os valores pagos. poderiam melhorar a embalagem de envio, mas faria novas compras tranquilamente.;1
74502;regular um dos pneus não deu alinhamento a bandagem está fora de centro só poderei usá-lo como estepe;0
74512;gostaria de agradecer pois o produto veio em perfeito estado e sem contar com o prazo de entrega. efetuei a compra no dia 31 de maio o prazo de entrega era de 22 dias porem e o recebi no dia 06 de jun;1
74521;adoro comprar nas lannister.loja muito séria;1
74540;coloquei 4 estrelas pois ainda não testei o produto , presente de natal, mais fiquei muito feliz com a agilidade na entrega...recomendaria com certeza...;1
74546;recebi antes do prazo estabelecido o lustre é lindo;1
74548;podia ter vindo os dois junto;1
74549;excelente;1
74586;não recebimento  não recebi o produto;0
74595;serviço muito bom! onrigada;1
74605;produto com defeito e sem retorno de targaryen.;0
74608;"produto entregue antes do prazo..
tudo perfeito, é pequena mas para o que quero está ótimo...";1
74625;brincos de qualidade, bonito...entrega rápida...tudo ok...;1
74631;pode comprar veio tudo certo;1
74654;livro muito bom;1
74676;otimo produto;1
74690;eu recomendo nota 10;1
74699;a entrega já tinha um prazo bem longo e quando estava chegando nos últimos dias do prazo eu recebi um e-mail informando que a postagem do produto seria atrasada. cancelei o pedido imediatamente.;0
74709;reclamação. não recebi os produtos mencionados no e-mail. recebi, como já disse, uma caixa de papelão vazia, sem nenhum conteúdo. como nas outras mensagens que já enviei, espero que meu problema seja resolvido.;0
74725;correu tudo bem como das outras vezes.;1
74727;lindo!! superou minhas expectativas;1
74739;fiz o cancelamento da compra há 13 dias (data em posto esse comentário). e até agora não cancelaram minha compra no cartão.;0
74759;muito bom e bonito ok;1
74764;produto entregue no prazo!;1
74767;bom dia, a entrega foi muito rápido e o produto de excelente qualidade.;1
74777;produto entregue diferente do que foi comprado,não recomendo o vendedor.;0
74786;dessa vez veio rápido;1
74808;ótimo;1
74827;entrega muito rápida.;1
74842;realmente eu queria ter um guarda-chuva invertido porque é diferente. mas desde que ele estivesse funcionando e abrindo, e não com cabo solto;0
74850;comprei uma pulseira pelo site porque tinha em estoque e após a confirmação do pagamento me ligaram informando que as pulseiras haviam acabado e que tinha previsão de quando iria chegar mais.;0
74888;ainda não recebi o produt;0
74890;alguns pinceis veio soltando as cerdas;0
74942;recomendo ótimo produto, material muito resistente e entrega antes do prazo.;1
74945;a cadeira chegou fora do prazo e ainda por cima veio com inúmeros defeitos, tecido do encosto rasgado, base de proteção das rodas rasgadas, roda travando, fora aos inúmeros arranhados espalhados.;0
74952;bom trabaho;1
74981;otimo vendedor;1
75003;o produto chegou certinho. ótima qualidade assim como anúnciado;1
75008;...........................;1
75012;melhor do que eu imaginei pelo preço a qualidade é boa e chegou dentro do prazo.;1
75017;o produto chegou corretamente e dentro do prazo;1
75036;recebi apenas o cubo mágico, ainda não recebi os tapetes.;0
75045;quero meu dinheiro de volta, foi muito decepcionante.;0
75048;ótimo obrigada estou satisfeita com a compra chegou bem antes do prazo...;1
75072;meu, chegou em 5 dias. antes donesperwdo. top!;1
75101;amei, do jeito que eu esperava, super rapido na entrega, adorei adorei;1
75112;muito bom;1
75116;bom atendimento;1
75118;apesar de ter vindo só um cartucho gostei da empresa. porém só veio um código de rastreamento pra mim, e nele estava o cartucho preto.;0
75120;ótimo produto  atendeu minhas expectativas, excelente produto com ótimo preço.;1
75150;como vou avaliar um.produto que não recebi ainda;0
75155;recebi o produto bem antes do prazo;1
75159;já comprei por diversas vezes nessa loja e esse foi a compra que mais atrasou.;0
75162;adorei, recebi antes do prazo e o produto, superou minhas expectativas.;1
75209;5 estrelas;1
75221;bom vendedor  chegou no prazo, ótima embalagem.;1
75224;"comprei bateria de 14 amperes, porém me entregaram uma de 12 amperes . 
não vou trocar o produto porque estou precisando com urgência e a de 12 amperes está funcionando, mas me senti lesada.";0
75246;sim, recomendo *** quando da compra me foi dito que o produto seria entregue até o dia 10/08/2018 e até o momento não foi entregue...;0
75265;foi muito bom;1
75268;"super recomendo site fácil de comprar, e a entrega é super rápida.
parabéns pelo excelente trabalho!";1
75285;nada a declarar.;1
75299;o produto é o que realmente eu havia solicitado, e a entrega foi no prazo. recomendo compras no site da baratheon e o produto também.;1
75306;tive que retirar na agência dos correios pois disseram que era encomenda e não tinha data de ser entregue.nao entendi o porque pois paguei o frete...;0
75311;produto de qualidade entregue com quase 30 dias de antecedência.;1
75312;ótimo;1
75336;so nao gostei do tumultuo dos correios;0
75337;boa noite, comprei dois produtos, paguei dois fretes e só chegou um produto, gostaria de saber o motivo de mandar um produto com valor de dois na nota, quero receber o que ficou faltando.;0
75340;o produto chegou no prazo é muito bom ??;1
75346;produto muito bom a princípio;1
75365;"ainda não conferi deixo em branco sobre o produto correto.
vou abrir amanhã";0
75370;produto de qualidade e entrega rapida.;1
75385;muito bom;1
75413;nao recebi o produto, ficaram de me entregar até di 15.11.2017 e depois foi para o dia 25.11.2017 e nada. estou decepcionada com o vendedor e lannister, porque tiraram o pedido nao consigo vizualizar;0
75433;reomendo a todos;1
75436;gostei do produto e a entrega foi muito rápida.. .chegou bem antes da data prevista recomendo..;1
75440;produto mal embalado produto chegou quebrado é material não é bom;0
75446;veio exatamente igual a descrição tamanho formato entrega super rápida eu recomendo protudo excelente nota 10;1
75462;o único problema é que a tesoura veio sem afiação, mastiga o cabelo do cliente. ainda não mandei afiar para saber se é boa...;1
75463;ótima loja produto de qualidade, rápida entrega.;1
75466;no prazo;1
75503;muito bom ,recomendo . entrega rápida .obrigado;1
75508;loja muito boa, já cmprei outras vezes e essa foi a primeira vez que atrasou!!!;1
75510;"o produto chegou antes do prazo.
como sempre stark é 10!!!!";1
75516;boa compra tudo ok;1
75519;está programado para o próximo dia útil;1
75551;eu comprei toalhas de banho e de rosto. não recomendo. má qualidade. prazo de entrega bastante alto.;0
75553;recomendamos;1
75559;super recomendado meu pedido anterior, 02-669169792 - fone de ouvido hbqi7, depois de carregar por 8 horas, não aguenta tocar por 5 minutos. que devo fazer.;0
75561;ótimo produto, entrega muita rápida. e fácil escalação;1
75579;estou muito satisfeito com a compra. produto de excelente qualidade, chegou antes do prazo !!! podem comprar com tranquilidade. parabéns lojas lannister pela competência, agilidade, honestidade.;1
75582;mais de um mês pra chega uma capinha;0
75583;"ainda não recebi o produto e por esse motivo não posso avaliar o serviço por completo. 
estou aguardando o produto.";0
75587;além de ser de qualidade chegou muito antes do prazo final.;1
75589;produto correto, entregue no prazo, preço bom.;1
75591;entrega rápida, mas esperava uma qualidade melhor do tapete, pelo preço aq na cidade encontrei melhor,mas gostei do desenho.;1
75607;chegou antes do previsto, serviço de entrega lannister sempre se antecipando ao prazo... parabéns!!!;1
75626;entrega  realizada com sucesso, achei os botões duros mas tudo bem.;1
75649;satisfeito produto conforme o descrito.;1
75655;"bom produto gostei 
e parabéns a loja q entregou antes do prazo 
recomendo";1
75662;muito grata..nada a declarar..;1
75669;comprei o produto com prazo de entrega de 30 dias, no dia que deveria ser entregue o status da compra foi modificado para 'não disponível'. não faturado, não transportado, nada!!!;0
75673;excelente produto;1
75674;o vendedor entregou o produto correto e mais de uma semana antes do prazo. muito satisfeita.;1
75685;"preciso receber o meu produto. 

ou cancelar compra feita no cartão. 

aguardo retorno ou estorno urgente.";0
75690;:);1
75721;recomendo;1
75726;super recomendo;1
75742;sempre recomendo produto recebido corretamente e dentro do prazo.;1
75747;acredito que não tenha recebido por conta da greve dos correios, então não posso avaliar o produto.;0
75754;. .;1
75777;recomendo.;1
75786;teve só um problema na embalagem pois o produto chegou um pouco descolado;1
75792;recebi o produto correto, porém a nf chegou em nome de outra pessoa.;0
75793;0 não foi entregue na minha casa tive que arca com a passagem de ônibus para panha no correio e não fui reembolsado.;0
75815;tudo certinho e chegou com antecendência! obrigado!;1
75819;há uma grande dificuldade em contactar o fornecedor para resolver qualquer problema.;0
75847;nao recebi este produto serviço ruim;0
75851;excelente material excelente, recomendo!;1
75895;eu recomendo um execelente de entregue muito rápido.;1
75906;recomendo a tds que quiserem comprar.;1
75909;produto ótimo, chegou antes da data.;1
75911;ótima compra recomendo o site;1
75917;a bolsa deveria ser revestida de espuma na parte interna;0
75929;meu pedido chegou bem mais rápido do que o esperado! maravilhoso!;1
75971;recomendo com restrições o produto veio embalado em jornal que grudou um pouco na pintura e ficou uma mancha no produto. poderiam ter embalado de outra forma!;1
75989;10;1
76013;excelente. parabéns pela eficiência.;1
76032;bom produto e valor, veio no prazo, recomendo.;1
76035;lannister.com estou satisfeita com os serviços de compra e entrega.;1
76045;site super confiável! produtos iguais ao da foto.;1
76054;sabor do produto é ruim e me deu gases depois de tomar a quantidade recomendada. faço uso de whey desde o ano passado e essa foi a primeira vez que um produto me causa mal estar.;0
76055;ótimo produto e excelente vendedor...recomendo-o.;1
76081;"nao pude comparecer para retirada do produto, pois estou no sul,
correios nao entregou no endereço onde eu morava,
quero o produto, se puserem mudar o endereço aqui p curitiba agradeço.";0
76082;entrega efetuado bem antes da data programada;1
76084;10 muito bom;1
76088;chegou muito antes do prazo. o produto é bem compatível com o preço.;1
76101;ótimo produto  boa apresentação do produto, vem numa maleta onde fica bem protegido e apresentável. entrega antes do prazo inclusive!;1
76110;ótimo;1
76121;pedi dois pacotes so chegou 1;0
76134;ñ compriu seu prazo de entrega;1
76171;cinco estrelas  muito boa;1
76180;eu cancelei o pedido e não teve reembolso do meu dinheiro no meu cartão . pessimo .. nunca mais compro nessa loja !;0
76185;recebi apenas o jogo de tapetes. a micro válvula de aerógrafo não recebi.;0
76186;adorei o site;1
76201;chego antes do prazo;1
76209;"chegou antes do prazo,
super indico, produto mto bom!";1
76222;excelente produto entregue dentro do prazo e conforme anunciado. muito bom.;1
76232;comprei um boneco hulk pro meu filho e ele amou. eu recomendo a loja entregou antes do prazo amei estão de parabéns....;1
76247;10;1
76248;produto muito bom de qualidade e entregou no prazo.;1
76251;produto bom;1
76269;chegou antes do prazo dado pelo site do stark gostei muito!;1
76279;faltou o açucareiro. nao veio junto.;0
76290;produto de ótima qualidade ...recebi 10 dias antes do prazo.;1
76291;produto entregue conforme expectativa. muito bom!;1
76312;apesar do atraso, recomendo sim.;1
76361;recebi a mercadoria 4 dias após a compra,show de bola!!!!;0
76367;uma bosta nao entrega, e nao faz estorno do valor.. vou ter que entrar com um processo contra lannister;0
76376;prazo de entrega e produto excelente;1
76381;fico grato pelo atendimento na loja e principalmente no tempo de espera estabelido pela loja, ja é a terceira vez que compro no saite da loja e não tive nenhum transtorno com a entrega ,grato.??;1
76391;ok;1
76420;muito bom;1
76446;adorei a compra, entrega super rápida.;1
76477;o produto que chegou é muito bom não vou trocar ,mas não foi o que eu escolhi a cor veio errada e com algumas partes estão diferentes da descrição.;0
76482;excelente.;1
76488;"entrega rápida, profuto devidamente embalado.
produto ok e acompanha pilha.";1
76513;adorei!! perfeito!!;1
76527;"bom dia 
a bolsa veio em ótimo estado, porém em uma bolsa somente um zíper veio diferente dos outros da bolsa!
a outra bolsa veio tudo ok !!!!";1
76532;fui enganado! comprei um produto e vocês me entregaram outro.;0
76541;foi rápido, antes do esperado, estou muito feliz com a compra, parabéns à todos.;1
76563;entrega muito atrasada.;0
76564;réplica infelizmente o relógio não é original, achei uma propaganda enganosa.;0
76584;bom o produto;1
76594;entregue pela metade comprei duas unidades do produto, mas no pacote só veio uma.;0
76612;super recomendado bom;1
76638;ok;1
76675;excelente;1
76684;cancelamento não efetuado solicitei o cancelamento do produto, porém mesmo assim foi entregue e recebido pela portaria do meu prédio. me recuso a ter o trabalho de postar no correio.;0
76690;foi entregue no prazo,produto entregue igualzinho que eu comprei o vendedor é muito responsável ,o produto com muita qualidade e lindooooooo?? amei;1
76696;gosto de comprar nessa loja tenho sido bem atendido.;1
76705;recebi o filtro incompleto faltando o sifão coletor aguardo providências;0
76707;atraso na entrega.;0
76709;vidro estragado veio com um vidro estragado;0
76710;ja reclamei varias vezes do atraso, não tive retorno e ainda não recebi a mercadoria.;0
76714;nas fotos do produto não tinha mostrando a parte de trás do tapete.. eu comprei pensando que era o tapete com as costas tradicional...;0
76722;veio tudo certinho conforme descrito o ruim foi apenas o prazo de entrega, mas tudo certo.;1
76732;"é bonita, só precisa prestar atenção nas medidas
na foto aparenta ser grande";1
76771;gostei bastante;1
76779;cliente satisfeito.;1
76808;muito comfiavel;1
76812;"bom dia
meu pedido foi duas saias até o momento recebi uma.
já veio minha fatura onde já foi descontado.
gostaria de saber se irei receber.";0
76823;muito bom;1
76824;tudo otimo;1
76832;razoável  é bonitinho, a base é de plástico. pelo preço poderia ser um pouco melhor.;1
76840;produto entregue antes do prazo e em perfeito estado!;1
76842;zero eu não recebi meu produto;0
76844;produto bom, entrega excelente .;1
76846;não dar a informação do produtos corretamente, o produto mais de duas semana na nota fiscal, e eu fiquei esperando anciosamente;0
76849;recomendado muito bom;1
76853;entrega rapida, produto bem embalado, atendeu minhas expectativas, tanto o produto qdo a loja e transporte.;1
76861;rapido!;1
76870;ótimo qualidade  recomendo a todos preços e prazo de entrega a melhor;1
76874;nao recebi produto pessimo;0
76884;não entregaram o produto;0
76893;entregou corretamente;1
76920;recomendado entrega dentro do prazo, muito bom.;1
76930;compra tranquila, produto escolhido entregue, tudo rápido .;1
76947;não gostei da embalagem;0
76988;10 otimo foi entrege antes do prazo;1
76997;otimo atedimento;1
77011;eu comprei das lojas lannister mas veio na embalagem do mercado livre, o que me deixou muito desconfortável.;0
77018;recomendo otimo;1
77027;bom produto. bom vendedor. entrega no prazo combinado.;1
77035;"melhor suporte nessa faixa de preço. é a segunda vez que compro, as duas vezes usei com tvs de 43"". ele deixa pouco espaço na parte traseira, então é bom ver o posicionamento das entradas da tv.";1
77046;liguem pra mim para mim informar alguma coisa 8198606-4483;0
77064;fiquei satisfeita com a compra.obrigada;1
77074;eu encomendei 3 e veio só 2 tô esperando.quando chegar tudo eu avalio de novo;0
77083;eu recebi o produto mas nao o que eu comprei e sim o produto totalmente errado muito triste;0
77089;gostei muito!;1
77091;chegou somente parte dos produtos!!!;0
77092;bom gostei otimo produto;1
77100;produto muito bom, aparentemente a bateria não é tão forte, descarregando rapidamente e comparação com outro note que tenho, fora isso mto bom, rápido e bonito.;1
77114;produto de ótima qualidade, muito fofinho!;1
77115;produto simples mas de boa qualidade;1
77121;recomendo chegou antes do prazo;1
77130;ótimo  o produto chegou em perfeito estado ,e no prazo;1
77142;"única falha: o segundo produto, adquirido no mesmo pedido, não foi entregue.
cburlamaqui@terra.com.br";0
77153;super recomendado  o tablet veio com defeito o que devo faze ????;1
77164;nada a declarar;1
77165;continuem assim;1
77177;ótima qualidade entrega muito rápida recomendo;1
77185;recebi o produto sem a respectiva nota fiscal;0
77196;tudo certo;1
77206;estou muito satisfeito! recomendo a todos!!!;1
77208;a loja foi irresponsável, pois não emitiu a nota fiscal e nem avisou se tinha o produto ou quanto tempo iria ter, ficou apenas dizendo que estava aguardando a emissão da nota fiscal, isso levou um mês;0
77213;o produto foi entregue corretamente e rápido. estava de acordo com o pedido. veio bem embalado. estou bem satisfeita.;1
77219;"meu pedido não foi entregue no prazo que seria até 06/06/2017 e hoje 08/06/2017 e nada do meu produto ,e tive que abre um ocorrência na lannister.

para verificar o motivo .";0
77227;ainda nao veio o produto;0
77232;demorou muito para o produto chegar. não compro mais no site;0
77246;a loja entregou no prazo mais o produto nao era o que eu espera no site deu a entender que era diferente.;0
77269;comprei dia 19/08/18 com previsão de chegada dia 24/08/18. até à data presente ( 01/09/18 ) não recebi o produto.;0
77283;"produto ótimo. aplicado na pele fica o dia todo.
entrega em 1 dia (bem antes da data agenda).";1
77310;não gostei do produto, a qualidade é muito ruim, ja veio descascando a camada, não gostei;0
77323;estou aguando o meu produto que não chegou dentro do prazo;0
77327;td certo, entrega dentro do prazo, segunda compra que faço pelo site, nenhum problema.;1
77334;ótimo vendedor;1
77336;produto não entregue;0
77341;produto de otima qualidade;1
77354;"produto não entregue o produto não foi entregue no prazo estipulado. nem ao menos uma satisfação foi dada.
espero um retorno e recebimento do produto ou o estorno da alta importância gasta.";0
77358;"mesinha de excelente qualidade. muito linda!! a entrega foi muito rapida, me surpreendi!! a mesinha veio bem embalada, assim evitando danos!!
????";1
77363;recebi o produto dentro do prazo estipulado com ótimo custo benefício. recomendo!;1
77376;deu um erro na entrega, ninguém ligou ou enviou email falando o motivo, e até hj não recebi o produto. era um presente de aniversário para minha filha.;0
77392;tapete  10;1
